title,id,review_text,recommendation,posted_date,playtime
Destiny 2,DoctorWebb,"I have about 1700 actual play hours in this game. I LOVE it. Bungie has come such a long way from the initial release of Destiny 2. There is always something to do, especially if you join a clan or have a solid group of friends. Come and find me in the crucible when you're ready, Guardian!",Recommended,2019.10.03,3.0
Destiny 2,GrazXoX,i love game,Recommended,2021.08.25,2.0
Destiny 2,Bumbo,"Whether we wanted it or not, we've stepped into a war with the Cabal on Mars. So let's get to taking out their command, one by one. Valus Ta'aurc. From what I can gather, he commands the Siege Dancers from an Imperial Land Tank just outside of Rubicon. He's well protected, but with the right team, we can punch through those defenses, take this beast out, and break their grip on Freehold",Recommended,2019.10.03,408.1
Destiny 2,Chips,"I play Destiny 2 almost exclusively and A LOT but I never run out of things to do in the game (triumphs, unlocking patterns, completing catalysts, running through raids or dungeons, clashing with other guardians in pvp, etc.). There are ways to play the game both casually and as a hardcore pvp or pve enthusiast. There is room for improvement, of course, but no other game hits replayability or future outlook quite like Destiny in my opinion.",Recommended,2024.06.04,7.0
Destiny 2,POKKET,"Hours later in Destiny, the life you have passes you by, but the time with friends in the game is worth it! Lightfall expansion is pretty short, but so much fun! I just wish they didn't remove any planets, quests so there would be more content to do. It's not always about finishing the recent release, but it'd be great to explore older stuff for those who haven't played when it first came out. Bring it all back!",Recommended,2023.03.08,256.7
Destiny 2,Codyno,I think I'm addicted.   Help,Recommended,2020.12.11,2.0
Destiny 2,ElSinRespeto,"Quite good since the new updates are coming out, i would definitely recomend this game. The only bad is that the PVP environment is currently full of cheaters making kind of messy.",Recommended,2020.09.03,2.0
Destiny 2,AznPwnage,name one other game that lets you shoot through walls,Recommended,2020.06.21,6.0
Destiny 2,Ikira Conti,"An amazing game with cool abilities and cool quests to play with. Become who you wanna be, and learn the truth about the world you live in.",Recommended,2020.06.10,5.0
Destiny 2,ThePlutonian,Game good,Recommended,2019.11.28,3.0
Destiny 2,Pure_Cipher,Bungie is doing good after its split from the greedy. Hope they continue their good work  Edit - Dont take Forsaken away,Recommended,2019.11.27,8.9
Destiny 2,A X E L,nice nice nice i love it :D:D:D:D:D:D:D Saas,Recommended,2019.11.01,4.0
Destiny 2,Exop!,bruh its free,Recommended,2019.11.01,133.3
Destiny 2,Aukos,"I've played Destiny games since late 2015 or so. Overall, both games are amazing, especially with friends. There have been some questionable choices made by Bungie, but no company can be perfect. Would recommend, love this game.",Recommended,2020.12.24,1.0
Destiny 2,InquisitorPikman,"I can't stop. I've been at this for years. It's an endless cycle that I have no intention of leaving.  Honestly though, this game is a blast with some major issues that are ALWAYS affecting it in some way. If you start, I would recommend bringing a friend or two, because the best content in this game is (in my opinion) the raids and dungeons, which are mainly co-op affairs. But a fair warning- if this game clicks with you, it REALLY clicks with you. No matter what grabs you, be it the tight gunplay, the beautiful art design, or some of the best lore in any game out there, there's a good chance you'll be pulled in for the long haul. That's just my two cents, so good luck to any New Lights out there, and eyes up fellow Guardians! (P.S. watch out for the Phalanx shields, you don't want to get physics'd.)",Recommended,2020.12.23,2.0
Destiny 2,berko,It's good thank.,Recommended,2019.10.03,206.2
Destiny 2,Turbo Fingerz,Game is best. I like much. Better than Borderlands.,Recommended,2019.10.02,2.0
Destiny 2,DXV,"Если вам мало вашей работы, то можете заходить еще сюда. У нас для вас куча заданий.",Recommended,2019.10.02,3.0
Destiny 2,Breaker,My wife left me,Recommended,2022.08.29,857.3
Destiny 2,Maclunkie,"come for the gameplay, stay for the DEEP LORE",Recommended,2019.10.31,660.1
Destiny 2,Taku,our fight against the W E A S E L goes on,Recommended,2019.10.02,88.5
Destiny 2,Pete Wellington Jr.,I like to shoot the alien,Recommended,2019.10.02,2.0
Destiny 2,thicc_shady on twitch,"i wouldn't stream any other game for 48 hours straight. With that said, this game is a trap, don't fall into it unknowingly",Recommended,2021.04.29,7.0
Destiny 2,The Jungle VIP,I'm stuck here and I can't leave.,Recommended,2020.12.13,3.0
Destiny 2,AnalParalysis,The only the MMO that doesnt make you think about WoW.,Recommended,2019.11.29,124.7
Destiny 2,DJ BALLS,"no matter how many destiny killers reddit tells you about, there will never, ever, be another destiny.",Recommended,2021.12.31,3.0
Destiny 2,BrokenSpoon,its ok i guess,Recommended,2022.05.25,2.0
Destiny 2,xX_EpicCoolGamer200_Xx,yeah,Recommended,2021.03.31,60.0
Destiny 2,coolcheese,bruh,Recommended,2019.11.23,5.0
Destiny 2,Stargazer,dont play this game,Recommended,2021.07.02,2.0
Destiny 2,Mocha,goes hard,Recommended,2020.12.24,1.0
Destiny 2,Kuhled-6,"At this point im only in it for the lore. MAY MY NAME IS BYF LIVE LONG AND PROSPER. ""Per Audacia ad astra"". Nope, I mean still in it for the lore.   Well after all this time I just can't leave this game the art, the lore, the overall feeling of the game is something that I can't find it anywhere else and with destiny 2 joining gamepass with all its dlcs there will never be a better time to give this game a chance. Okay okay I'm also in it for the loot again since the loot THAT HASNT BEEN SUNSET WONT BE SUNSET SUNSETTING IS GONE BOYS.",Recommended,2019.10.02,2.0
Destiny 2,rhett and link superfan,the worst best game i have ever played,Recommended,2020.06.04,3.0
Destiny 2,HolySmokey,"the game is fun, for a while..",Recommended,2019.11.28,25.8
Destiny 2,Ned-5,Product received for free  gmae,Recommended,2019.11.02,4.0
Destiny 2,Ethan Winters,TOTALLY WORTH OF MY MONEY ! PLAYED THE FREE ONES FOR A MOMENT THEN BOUGHT TWO DLCS WITH FULL PRICE ! DAMN I LOVE THIS GAME !!!,Recommended,2019.10.31,191.9
Destiny 2,Th3,eh it's good I guess,Recommended,2023.11.03,1.0
Destiny 2,sweatshop owner,Pretty Fun When You Six Stack With MT Tops...,Recommended,2020.08.14,1.0
Destiny 2,Yaz,After 3300 hours! i would say i love this game but need much more content! waiting on Witchqueen to see how it goes! :),Recommended,2021.06.26,6.0
Destiny 2,StumpoMan,Pew pew,Recommended,2021.04.08,532.6
Destiny 2,CrAzYJoKeR1,"Product received for free  Im Depressed, poggers",Recommended,2021.05.27,4.0
Destiny 2,elo,"I hate Destiny, it's my favourite game. Bungö owns my soul and my mind, once you get into this cursed game you can't scape... help me.",Recommended,2020.05.13,2.0
Destiny 2,barcode,"if you like the shoot and loot, buy the doot doot 2",Recommended,2019.12.03,4.0
Destiny 2,Ricky Dicky Doo Dah Grimes,waiting to travel simulator,Recommended,2019.10.19,6.8
Destiny 2,Ronald Ulysses Swanson,:),Recommended,2019.11.27,58.8
Destiny 2,Pintsize,"Been playing the Destiny franchise since launch in 2014, through the highs and lows. I'd say now is the best it's ever been, and I could not recommend this game enough, especially if you have some friends to play with you. If you don't, don't worry, this is one of the most wonderful communities you'll find, so clans will take you in in a heartbeat!",Recommended,2019.10.02,5.0
Destiny 2,Nussel,"I can recommend this game, if you're looking for a good looter shooter.   Pros: -really cool lore -cool classes -grinding is fun, most of the time -good gunplay  Cons: -almost no content for PvP -RNG can be a pain",Recommended,2019.10.02,4.0
Destiny 2,gerard tacklebox,I think destiny 2 is a pretty cool guy. Eh kills goods and doesn't afraid of anything.,Recommended,2019.10.15,2.0
Destiny 2,Skippy,"I am writing this from the future the message reads as follows - ""dead game"" - random twitter user circa 2021",Recommended,2021.09.03,4.0
Destiny 2,Shadow シャドー,,Recommended,2019.11.30,2.0
Destiny 2,LOVE,"Product received for free  Terrible game , my marriage is ruined because of it. Would play again",Recommended,2022.06.20,1.0
Destiny 2,Ango,this game has ruined my life,Recommended,2020.11.29,3.0
Destiny 2,Steezy,PVP IS ASS,Recommended,2020.11.19,1.0
Destiny 2,Barracuda,It's OK i guess...,Recommended,2020.08.29,3.0
Destiny 2,xplo1t,super fun when you play with friends...especially when pushing them down a cliff,Recommended,2020.07.06,271.9
Destiny 2,CaptainP,You can spend few hours at at time. Lots of things you can do. New players starting after Beyond Light will have a different experience than older players. Both are good.,Recommended,2019.12.26,3.0
Destiny 2,GuDliK,i am gay,Recommended,2019.11.15,196.4
Destiny 2,Sloppity Bilepiper,Glowing Smurf                                              Nuff said,Recommended,2019.10.02,758.7
Destiny 2,Cusco,"I've met some of my best friends from this game. Be careful guardian, your light will fade away.",Recommended,2019.11.27,3.0
Destiny 2,WHIXSKY,It's free like John Inman,Recommended,2019.11.27,0.1
Destiny 2,Lelleigh,toxic relationship with the game pls help,Recommended,2021.07.02,2.0
Destiny 2,fuzzurio,pretty good for a f2p game,Recommended,2019.11.29,217.6
Destiny 2,BRT Cobra,Talk to Amanda to kick off the campaign and enjoy an Epic free game,Recommended,2019.10.02,147.9
Destiny 2,Bastion56,DEAD GAME,Recommended,2019.10.10,4.0
Destiny 2,FlosK,"Despite the bumpy road this game had on its beginning, this is a quite enjoyable masterpiece. Even though it is not revolutionary on its game mechanics per see, and has a considerably shallow gameplay loop, it is immersive enough to spend some handful of hours on. Be it just shooting at anything that moves, trying out some PvP, taking a tour over the beautiful landscapes exploring all the secret stuff, hunting pieces of lore, or just doing the campaign missions, nightfalls, or raids. The atmosphere is indiscutibly immersive Amazing soundtrack by the same composers from nothing less than Halo Gorgeous art direction and level design Incredibly satisfying gunplay And an extensive yet unobtrusive lore that is right there for anyone interested to dive in Well-timed comic relief within the dialogues Lovable and iconic characters, which they could have explored more on the main basegame campaign, but that they nailed it on the subsequent expansions, especially the Forsaken.  Easily one of my favorite games ever, even though FPS is one of the genre's I'm not very fond of.",Recommended,2019.11.07,47.5
Destiny 2,Snowdrop,Still hate this game. Still play it everyday. Still need help.,Recommended,2023.02.09,1.0
Destiny 2,Torta Thumper,I dislike this game very much!,Recommended,2022.04.18,4.0
Destiny 2,FinxOmally,"One of the few games as a service games that actually is still standing, there is a reason for that. Great game and keeps you coming back, even if you get fatigued and go play something else you always come back.",Recommended,2020.01.29,10.0
Destiny 2,♡ChrissyB_ZA♡,Great game perfect to play with friends,Recommended,2019.11.01,501.2
Destiny 2,⛧ Millie Morbid ⛧,I have been a big Destiny fan since almost day one of D1. There was some rough patches before Shadowkeep but they are fixing the problems that were there and are continuing to give us worthwhile content. I absolutely love this game again and have put hundreds of hours into it before and after the steam merge.,Recommended,2019.11.27,2.0
Destiny 2,Bernd,"I am a 45 yo father, probably one of the oldest people playing this game. I am a single father to my Son, who is 14 now. My son got this game for Christmas in 2021 from his uncle, so we installed it on his computer and he started playing. By the end of the week he had 24 hours on this game. This was horrible for me, as it was already hard for me to find ways to spend time with my son, as he is always out with his friends or just watching YouTube. So i decided to make a Steam account and get this game to see if I could maybe play alongside him. I loaded into the game, picked my character and world and started playing but I was stuck on what you where supposed to do. I asked my Son for help and he hosted a game for me to join. I loved it as it was the best time I had spent with my Son since my wife had died. This game has ever since brought me and my son closer again and now we actually spend time together outside the house together as well. This game reminded me that there's fun to be had in everything, and it has brought both me and my Son many happy memories.",Recommended,2023.05.07,36.6
Destiny 2,Roach,buy everything DEFINITELY NOT OVERPRICED i love this game buy everything,Recommended,2021.06.05,905.5
Destiny 2,Blue,the people shoot me and is not nice!!,Recommended,2023.01.14,532.0
Destiny 2,TOG | Phanjam,Gameplay 9 out of 10. User documentation 2 out of 10.,Recommended,2023.01.03,267.1
Destiny 2,SirDmitriR,Its aight.,Recommended,2020.07.10,2.0
Destiny 2,NoxRW,a good game for friend to play together,Recommended,2019.12.01,10.2
Destiny 2,Dearune,new to the game and somehow legend gear are easy to get ( depending on my luck btw ) fun to play anyway,Recommended,2019.10.11,39.6
Destiny 2,8492nd,Light,Recommended,2019.10.14,357.5
Destiny 2,WordSlice,it good,Recommended,2019.12.13,2.2
Destiny 2,Epixauce,"<Well over 200 hrs on the Blizzard launcher>  This game has always had a lot of charm and attention to detail with the gun-play and controls and I think that is something that has always kept me playing! The PvP could definitely use some balancing, but that is the case in a lot of games. Other than that, its a great game with a TON of content, even ruling out Forsaken and Shadowkeep!",Recommended,2019.10.08,633.5
Destiny 2,Ligitie,h̵̦̫̻̼͗̍́͐̈́͗́͘͠e̷̝̪̭͍͉͙̤͠ľ̵̨̨̗̞͕̺͉̪͜p̶̯̮̮̹͔̳̅͌̚,Recommended,2023.08.27,2.0
Destiny 2,Khostly,"Dont buy it, it'll ruin your life.",Recommended,2023.02.10,3.0
Destiny 2,Secro,don't play it,Recommended,2022.01.19,918.8
Destiny 2,"Drai'Nho, The Consumed","I absolutely hate this game, and it has a major choke-hold on my social life... So yeah, it's my favorite game",Recommended,2021.12.22,1.0
Destiny 2,Zachary Morgan,It's like crack but theres's no rehab for this.,Recommended,2021.09.27,3.0
Destiny 2,cow_apocalypse,Literally the worst game,Recommended,2021.03.18,5.0
Destiny 2,KingMateo,Great game but lacking content at the moment. Heard there's a skeleton crew working on the fall expansion so that may explain why. Amazing game to play with friends tbh.,Recommended,2020.04.29,2.0
Destiny 2,Sundazed_Rosh,"I highly recommend this game for those who seek to be a bonefied badass and go out in a flaming blaze of glory, No comment needed when you have 1,844 hrs in destiny and just enjoying the content over and over again with friends along the way",Recommended,2020.11.26,4.0
Destiny 2,Meowtilater,This game and it's predecessor were both great games in my opinion. I migrated to PC from Xbox after cross-save was added and it is great on PC as well!,Recommended,2019.12.02,610.2
Destiny 2,Brick,fun coop game,Recommended,2019.11.28,3.0
Destiny 2,hmm?,Product received for free  Pretty fun game with your friends,Recommended,2019.11.27,20.0
Destiny 2,HeadlessM8,very very entertaining even for solo players and especially fun with teammates but dlcs cost a lot :P but the main story isnt that short.... but i heard that DLCs have more story,Recommended,2019.11.27,58.7
Destiny 2,otoe,This game is improving,Recommended,2019.11.24,903.1
Destiny 2,ahmadsyar,Pros: -Excellent graphics. High end gpus can utilize this part.  Cons: -Not newbie friendly. No definitive guides. It's like they throw a lion cub into the wild and expect it to survive.,Recommended,2019.10.16,43.3
Destiny 2,TrIcK.ftw,"Nominated for Labor Of Love , isn't it obvious why? because its a grind fest which sometimes its worth the dopamine and sometimes not . ""When you whisper in the void guardian , does it whisper back ? """,Recommended,2019.10.09,689.5
Destiny 2,TURBO GAMER,nice game tbh,Recommended,2019.10.06,1.0
Destiny 2,KiwiKing,"Destiny is an incredible experience set in an incredible universe beautifully crafted by Bungie. There is so much packed into this game that almost anyone can find something to enjoy. There is such a diverse range of activities to tackle, all set in a masterfully crafted world for an immersive experience not quite like anything else. Its looty, its shooty, and its a damn good time backed by an incredible community that's full of helpful people. Best of all, it's free to start! Loads of content is included with the free version of this game, and there is really no reason not to give it a shot.",Recommended,2019.10.06,1.0
Destiny 2,Xeonce,It okay,Recommended,2019.10.31,305.6
Destiny 2,Wormgod-Xol,Product received for free  its ok i guess,Recommended,2021.01.02,3.0
Destiny 2,Jestyr22,"Yeah, it's not bad With like 5x the playtime since my review, I feel like I should update. It was bad for a little bit, now it's back to being not bad",Recommended,2019.10.27,3.0
Destiny 2,Bawitdaba,"From the people that made O.G. Halo, they nailed the looter shooter and ""space magic"" within this game. It will hook you if you are a fan of replayable content.  Story line is just medicore to ok or average. Shadowkeep was one of the better campaigns they have added even if it was fairly short.  Most fun when played with friends, the raiding experience is incredible and crucible (PvP) and gambit (PvEvP) and strikes (PvE) are very very fun.  Lots of quests and guns to keep grinding for!",Recommended,2019.10.04,8.0
Destiny 2,bloom into you battle royale,"Destiny 2 is phenomenal. In my opinion, it was never bad and has only gotten better. It's a game with developers who genuinely want to make something really cool. Before it launched on Steam, I put thousands of hours into it, and I can't wait to put thousands more. Extremely player-friendly progression mechanics, cool stuff to chase, incredibly tight gameplay, and a world that feels fresh every single week combine to make this game one of my favorite games ever made, if not the number one. Please try this game. It's not for everyone, but it can be for anyone, and if it clicks with you, you're joining an incredible community that genuinely loves this amazing, goofy, phenomenal, incredible game with all their heart.",Recommended,2019.10.02,3.0
Destiny 2,Ginga,"If you have the energy to sink all your time into the game it is really fun. The end game is peak, doing raids with friends or randoms is some of the most fun I've had in video games. But to enjoy that u need good gear and that requires time, and weapons that you grinded for cuz they were good might be obsolete a month later. But if you can sink time into the game I'd say the payout is huge.",Recommended,2024.02.20,1.0
Destiny 2,Endgame Content,I have finally uninstalled this game only for Witch Queen to drop in 5 weeks in which i will have to continue my suffering.,Recommended,2022.01.13,2.0
Destiny 2,King Tarquin,"Product received for free  Before playing this game, ask yourself if you have time for it - because you're going to need a lot of that",Recommended,2019.11.27,3.0
Destiny 2,meow,its like destiny but the 2nd one,Recommended,2024.05.28,88.8
Destiny 2,Häxprocess06,"Not perfect by all means, but fun and entertaining for sure.",Recommended,2020.07.26,1.0
Destiny 2,claimable catboy,Its ass but i cant stop playing,Recommended,2023.12.28,2.0
Destiny 2,wwwwwwwwwwwwwwww,why is this game like that,Recommended,2020.02.01,2.0
Destiny 2,amirrezachehrehara,it's one of the best game i've ever played.but it could be better if it had some guide for some activities and quest.some of them are so complicate.,Recommended,2019.10.07,105.6
Destiny 2,ExoSage,"Destiny 2 is a very good starting point if you're trying to get into looter shooter genre, compared to other games in the same genre, It can be catered towards both Casual players and Hardcore players as well and a good PvP Experience too. The game got Fantastic Lore and Story Arc and the Gunplay is Top Notch. I'd Highly recommend this game to anyone who's thinking of getting into Looter Shooter genre.",Recommended,2020.10.13,3.0
Destiny 2,IceCoolTea,"Bad: -PvP is extremely bad -Servers can't handle big traffic -No Global chat to spit toxic stuff at opposing pvp players -Gambit is ruined by invasion -Gambit is ruined by Gambit -FOMO tactics implemented in game, to get you grinding stupid stuff -It's technically Farmville, can't complete major quests because of time based rotations  Good: -Nice guns go pew pew",Recommended,2020.04.20,3.0
Destiny 2,LetNashPlay,Badhiyaa game hai khelne layak le lo maza aaegaa dosto ke sath khelne main!  Dost banao aur khelte jao!,Recommended,2019.10.03,870.1
Destiny 2,Crash,"It's Destiny, you either love it and play it or you hate it and will never touch it again.",Recommended,2020.06.11,1.0
Destiny 2,Duckie504,"I still hate this game. I just can't stop playing. Send help, please. I haven't seen the outside world in months.",Recommended,2021.11.10,2.0
Destiny 2,N4,perfect,Recommended,2019.12.18,1.0
Destiny 2,frost,dont get this game,Recommended,2022.12.07,2.0
Destiny 2,Rob_Bay,Best life-service game for a while. Might help if you're waiting for your dad with the milk. You really need him and milk in the droughts. Much more fun with friends or randoms. Solo content is still top notch.,Recommended,2019.10.03,6.0
Destiny 2,Emberwing,"it started out rough but got better the longer its being updated. i highly recommend trying it out since the future of this game is looking bright.also i meet by best friends playing this game and we all still play it. the issues that it has right now is the repetitive of grinding light levels is really slow starting out and you mostly play the same activities. i would strive away from pvp since it is not new player friendly, just badly balanced and can be quite toxic from time to time.also the expansions are where the game strives and can be quite expensive but not nearly as bad as mmo where you pay monthly.",Recommended,2022.01.17,3.0
Destiny 2,Mimikyu,Who knew shooting aliens with space magic to defend a giant golf ball from its super spicy dorito persuers could be so fun?,Recommended,2020.06.25,2.0
Destiny 2,SSGS_Vegeta,Product received for free  pretty cool,Recommended,2019.11.11,829.8
Destiny 2,S'vonne Irra,Halo and Borderlands had a baby and it has some of the most satisfying guns to shoot on the market. And it's free now. There really is no reason not to try it.,Recommended,2019.10.03,745.8
Destiny 2,Kenji,"De graça, muito conteúdo e poucos ADs (propagandas). O jogo não lhe força em nenhum momento à realizar alguma micro-transação.",Recommended,2020.11.03,29.5
Destiny 2,LigitTortle,This is definitely one of the games I've played,Recommended,2020.08.29,2.0
Destiny 2,frogteeth,This game sucks definitely get it.,Recommended,2020.11.14,2.0
Destiny 2,carlg449,played game since D1 has its ups and downs but good loot n shoot,Recommended,2024.09.02,230.8
Destiny 2,cil0c,WEASEL CURRANT CENTIPEDE BEE WEASEL CURRANT CENTIPEDE BEE WEASEL CURRANT CENTIPEDE BEE WEASEL CURRANT CENTIPEDE BEE WEASEL CURRANT CENTIPEDE BEE WEASEL CURRANT CENTIPEDE BEE WEASEL CURRANT CENTIPEDE BEE WEASEL CURRANT CENTIPEDE BEE WEASEL CURRANT CENTIPEDE BEE WEASEL CURRANT CENTIPEDE BEE WEASEL CURRANT CENTIPEDE BEE WEASEL CURRANT CENTIPEDE BEE WEASEL CURRANT CENTIPEDE BEE WEASEL CURRANT CENTIPEDE BEE WEASEL CURRANT CENTIPEDE BEE WEASEL CURRANT CENTIPEDE BEE WEASEL CURRANT CENTIPEDE BEE WEASEL CURRANT CENTIPEDE BEE WEASEL CURRANT CENTIPEDE BEE WEASEL CURRANT CENTIPEDE BEE WEASEL CURRANT CENTIPEDE BEE WEASEL CURRANT CENTIPEDE BEE WEASEL CURRANT CENTIPEDE BEE WEASEL CURRANT CENTIPEDE BEE WEASEL CURRANT CENTIPEDE BEE WEASEL CURRANT CENTIPEDE BEE WEASEL CURRANT CENTIPEDE BEE WEASEL CURRANT CENTIPEDE BEE WEASEL CURRANT CENTIPEDE BEE WEASEL CURRANT CENTIPEDE BEE WEASEL CURRANT CENTIPEDE BEE WEASEL CURRANT CENTIPEDE BEE WEASEL CURRANT CENTIPEDE BEE,Recommended,2023.09.25,435.4
Destiny 2,PDL,verygood cantot,Recommended,2019.10.27,83.3
Destiny 2,Shho13,Destiny 2 at this point is what it should have been at the release a few years ago. Fun.,Recommended,2019.11.29,76.3
Destiny 2,Dass,I kinda wished I had never found out this game existed.,Recommended,2024.11.28,6.0
Destiny 2,Sapphires,Pew pew pew!,Recommended,2019.11.27,21.4
Destiny 2,Mei,I've put way too much time into this game.,Recommended,2019.10.02,1.0
Destiny 2,HarveyDentCanHeBeTrusted,"Very good, Lots of Glimmer, Wow",Recommended,2022.06.07,1.0
Destiny 2,Phil Swift,"idk its cool and addicting, please help",Recommended,2019.11.10,6.0
Destiny 2,BlikkieKop872,"Was so excited to have this game on Steam now! Such a great looking game! Story is good too. It's not a game for everyone but i can compare it to Warframe, so if played and enjoyed that, then possible can get into this too",Recommended,2019.11.27,10.3
Destiny 2,Akyut,"I'll be playing destiny when the bombs drop. Eyes up, guardian ( ͡° ͜ʖ ͡°)",Recommended,2021.04.28,3.0
Destiny 2,MadKaiserWilhelm,Good Lore Decent PVP Amazing PVE,Recommended,2021.05.17,4.0
Destiny 2,DIXON,bing bong,Recommended,2020.03.23,73.9
Destiny 2,Vendetta,Amazing Game,Recommended,2019.11.30,16.1
Destiny 2,Edge,Must play if you like looter shooters.,Recommended,2019.11.27,1.0
Destiny 2,Nightwing2511,very much recommended,Recommended,2020.05.10,1.0
