title,id,review_text,recommendation,posted_date,playtime
Destiny 2,Alfred Niles,"If you enjoy Borderlands-esque loot grinding and PvE team-play, then this might be worth your time. I played the beta and main game decent amount of time, but put it away before the first xpac dropped because i kinda exhausted myself, but coming back now and having the new content to play with for free is as fun as I originally found it to be. The abilities are satisfying, and the gunplay is pretty solid, but some of the missions can get repetitive which can obviously turn people off. Overall, it's a pretty great package that they deliver for free.",Recommended,2019.10.06,165.5
Destiny 2,Noire,"great community, great gameplay, and you can tell that it has the foundation that bungie provided considering they made Halo",Recommended,2019.10.04,19.8
Destiny 2,Sage,"It was a hot summer evening, I was up playing Overwatch really late with a couple of friends who love Destiny. I've had the notion that Destiny was a motionless grind of uneventful crap that has had a hard time with players, years before I even had the idea of trying the game. one of my friends told me to give Destiny 2 a try since the base game was free at the time and the Forsaken DLC wasn't too expensive.  I bought it.  I skipped the Red War, Curse of Osiris and Warmind, I jumped right into the Forsaken campaign with a couple of friends, I was instantly stunned by the immense beauty the game had. Bungie has really outdone themselves with the artwork and voice acting.  I loved the gun play, the sense of accomplishment after a week long grind for something that I knew had some uniqueness to it, I loved the complex raids and different quest steps.  There is so much I can write here but Shadowkeep is calling my name, overall; Destiny 2 has come a long way and It truly is worth trying now, especially since so much of the game is Free 2 Play. Good luck Guardians.",Recommended,2019.10.04,675.9
Destiny 2,Jedobi,"Having been playing this series since Destiny 1 on consoles and eventually owning and playing Destiny 2 since beta, i can say this is overall one the my favorite gaming series I've ever played. As far as shooters go this game does a lot right. Each weapon class feels where it belongs, there is always a meta but even so everything has its place and works. The story and setting of the destiny world is absolutely fantastic, its stunning in every way. This game offers a piece of it self to everyone, you have a very fun PvE game with tons of hours of content. From the story to the Nightfalls and Raids they are all fun. The PvP is great, the game play is always changing every season. Each class has its strong suits and weak ones but none are under powered. For me I cant find a better game to spend my time in. The community is super engaged, you can use LFG to find people to play with, the developers are actively listening to player feedback and try to create a good experience.",Recommended,2019.10.02,124.0
Destiny 2,SleepySerena,"TL;DR: The game's free, try it out for yourself. If you want people to play with, check out the Destiny 2 PC LFG Discord server, it's the largest one available. Take the game at your own pace, don't worry too much about being a top-tier player right off the bat.  -------------  Very few games match the immensely satisfying gameplay of Destiny. The gunplay is fantastic, using space magic never feels old, and doing challenging endgame content with buds is one of my favourite aspects of gaming in general. Destiny 2 is my most played game (across Steam and battlenet) because there's a lot of content, and a great (with some exceptions) community to go along with it.  I say ""with some exceptions"" because the majority of the bad eggs you'll encounter are Destiny veterans, thoroughly unsatisfied with the state of the game after 6 years. These people, most of which have been with the series since its inception in 2014, can influence newcomers' opinions before they even try the game.  I will admit that Destiny has been through a cycle of tremendous highs and dismal lows. Every fall, a big expansion comes out and it sweeps the floor, bringing in record numbers and glowing reviews. Then, 6 months later, there is a cloud of dissatisfaction and toxicity that infects discussions as the game fails to meet the fans' expectations of content.  Just know that you are stepping into a series that has had a tumultuous history. But history shouldn't change your first impression.  Destiny 2 has it all: interesting lore, a heap of loot to chase, activities for both PvE and PvP enthusiasts, a mostly helpful and passionate community, and limitless room to learn and grow as a player. If you're jumping in the for the first time, you're in for a wonderful journey.",Recommended,2019.10.04,5.0
Destiny 2,Resurii,Why haven't I played this before?,Recommended,2019.10.03,2.0
Destiny 2,Emlyn's Moon,Moon's Haunted!,Recommended,2019.10.02,662.7
Destiny 2,newport merchant,i like this game but the monetization is horrendous now each year is a full-priced game if not more and you have to buy all the previous dlc to blow through the content just to get the stuff you need to excel in late game  but still pretty fun i guess,Recommended,2019.10.02,1.0
Destiny 2,xenomorph yuri,good,Recommended,2019.10.02,2.0
Destiny 2,frontporchtreat,"Destiny 2 has been one of my favorite games of all time, I recommend trying it. Shadowkeep has been having a buggy launch (about as bad as forsaken) but the visuals and gameplay continue to be great.",Recommended,2019.10.02,1.0
Destiny 2,Lightouch,Not bad,Recommended,2019.10.02,5.0
Destiny 2,Phlix,One of the best FPS out there.,Recommended,2019.10.02,333.7
Destiny 2,Em1ssary,"I can't even describe how much I love this game. Countless hours sank into this game, and countless more on the horizon. Big recommend from this guy",Recommended,2019.10.02,2.0
Destiny 2,RLD!,Product received for free  Very enjoyable!,Recommended,2019.12.05,65.8
Destiny 2,Quick,"You just never quit, do you? Took out Ghaul. Woke up the Traveler, and now half of what i hear in the streets is how much you and your clan are making a difference. That's why i started this whole clan thing in the first place. People are still waiting for the Vanguard to lead the way. But it's time for a change, and guardians like you are making it happen. No pressure.",Recommended,2019.10.02,5.0
Destiny 2,Fraubo,"Like most players leaving a review I've been playing since the launch of Destiny 1 since 2014. This franchIse has seen lots of ups and downs but I can only imagine that things will just get better.  Bungie has left Activition and now they're free to make this already beatiful and filled with content game a lot better.  The free offer is hundreds of hours long for the most hardcore mmo players and still decent to good story to the more casual one with missions spanning all over the Solar System.  And if the content wasn't enough the game looks and sounds amazing. Something that you only see on AAA games which Destiny was and still is....but for FREE!  I suggest downloading it even if you think you're not into it. It's FREE!  Eyes up,Guadian!",Recommended,2019.10.02,586.0
Destiny 2,metamoq,I recommend it for sure. Fun game play and nice graphics.  However! Be careful if you are transferring! Any small glitch on either your side or theirs will destroy any progress you have made with your blizzard account. I've lost everything I had and will have to start over. All the money I spent is gone. Characters are gone. They are doing nothing to fix this and their only 'fix' they recommend 'make a new steam account' doesn't work either. Good game but really terrible support for issues.  Buyer beware: If you have an issue you are SOL. If you spend money on the game be ready to lose it to the void of their support.,Recommended,2019.10.20,13.5
Destiny 2,Unknown,"Maybe one of the best games that I have ever played, the weapons are very cool and well done, the raids and the various game modes are very beautiful (although there are few modes), unfortunately the game remains a pay to win and if you don't buy the dlc there is nothing to do, however if it s played in company and with the dlc it is definitely worth trying",Recommended,2022.07.28,296.1
Destiny 2,Mathenix,Best Graphics ever.,Recommended,2019.11.27,14.8
Destiny 2,Ynsane,very cool gamer time,Recommended,2020.11.10,2.0
Destiny 2,[TSS] Penny,"I truly love this game from the bottom of my heart. It is my most played game of all time. it does have some serious issues: my main problem being how a lot of content is stuck behind a pay wall. but after playing this game for 4 years all I can say that every cent is worth it.  the characters are well written the music is fantastic the gameplay both ability and gun play wise are extremely satisfying and fun  the developers care about the game and the community they update us weekly on what they are working on game breaking glitches are fixed extremly quickly and community efforts like art, videos and even a fashion magazine are embraced and supported  the lore is expansive, well written and truly immersive i have cried, laughed and even been horrofied by it  yes, at the end of the season it gets a little boring but I know that at the beginning of a new season, something new is gonna come along that will remind me of how much i love it  i have a few other games like Portal 2, that cheer me up when i am at the bottom but after playing it over and over it just doesnt have that same feeling anymore, that I had when I played for the first time  destiny 2 doesnt have that  whenever something new comes along I truly feel like the very first time i booted up the game  it is grindy it is an MMO it can be frustrarting in PvP  but the genuinly caring and open minded community and the active devs really make me feel like I am part of something greater  a place where I am accepted for who I am  And only judged because I use Vex Mythoclast in PvP  if you dont have someone that is already addicted to this game to introduce you to everything it will be difficult to get the hang of it, yes  but download the free version  you can still do the main playlists a basic story mode one fantastic dungeon and my second favorite raid in the entire game  Eyes Up, Guardian",Recommended,2022.05.20,4.0
Destiny 2,niftyjay,where the real mission is finding more storage space.,Recommended,2024.01.08,1.1
Destiny 2,Buttercup,glaive,Recommended,2022.05.09,1.0
Destiny 2,Fusiion,Just Teabag in crucible and youll have fun,Recommended,2021.07.09,3.0
Destiny 2,Breach,dope,Recommended,2021.06.13,4.0
Destiny 2,nabski 👑,I have a love-hate relationship with this game. Wouldn't recommend.,Recommended,2021.02.26,1.0
Destiny 2,Sol The Spirit,Ikora stole my Shampoo Deluxe cream that costed me 2000 glimmer,Recommended,2020.11.15,4.0
Destiny 2,OniLynx69,"Uwu juwst nevew quit duwu uwu?  Took out ghauw, woke up the twavewew, awnd now hawf of whawt I heaw own the stweet iws how much uwu awnd youw cwan awe making a diffewence. Awnd thawt's why I stawted thiws whowe cwan thing in the fiwst pwace.  Peopwe awe stiww waiting fow the vanguawd tuwu wead the way. Iwt's time fow a change, awnd guawdians wike uwu awe making iwt happen. No pwessuwe.",Recommended,2021.08.29,5.0
Destiny 2,large,havent spent enough time to get into it,Recommended,2019.11.23,4.0
Destiny 2,Nesh,"Mara is hot, rest of the gameplay is alright.",Recommended,2019.11.14,1.0
Destiny 2,Unburnd,this game is a lot like sex i never get what i want,Recommended,2019.10.03,3.0
Destiny 2,Kryptoobs,"The game is basically robots, smurfs, and humans being given immortality by a giant ping pong ball in order to fight the forces of evil geometry.",Recommended,2019.10.03,3.0
Destiny 2,Jake,stockholm syndrome,Recommended,2021.08.11,2.0
Destiny 2,Centipede,gay,Recommended,2020.03.17,2.3
Destiny 2,Fatty Obeser Slapper,I have been infected with the Corona Lite Virus,Recommended,2020.01.26,117.7
Destiny 2,Flash,"Played a bit, its meh",Recommended,2019.10.25,2.0
Destiny 2,xDormblade,it's fun,Recommended,2020.02.11,2.0
Destiny 2,Falkon96,Space horse,Recommended,2021.12.10,301.1
Destiny 2,ambmirrr,"The main campaign, ""Red War"" is no longer playable. I only downloaded this game because I wanted to catch up to that experience, however, what I came to was only confusion. Didn't know where to start, its a shame.",Recommended,2024.12.23,111.1
Destiny 2,North,Add my Discord for a Trials Carry! Discord - aptnull,Recommended,2023.06.26,4.0
Destiny 2,Sammie,Killing myself,Recommended,2020.08.14,6.0
Destiny 2,Nico Robin ♥,Its a very good game. Very fun to play with friends..,Recommended,2020.06.26,2.0
Destiny 2,DirtyDan,"Destiny 2 is a first-person, looter shooter that is honestly... very good now that Activision is gone. With Bungie moving to Steam, it just made everything seem smoother.  Now, if you play Destiny 2 for story, youre in it for the wrong my friend. It stands out in the activities like raids and other content. Loot can be a slow process at some points, but it is fun with friends.  Fun lol",Recommended,2019.10.12,240.3
Destiny 2,Luuk,"Super Fun Game, Great story line, hours and hours of enjoyment.  I recommend this game :D",Recommended,2020.01.02,121.9
Destiny 2,Terminator's Cousin,its ok,Recommended,2021.08.12,2.0
Destiny 2,Funny,Video Game,Recommended,2020.11.26,3.0
Destiny 2,D3ADW07F,good pve worst pvp ever,Recommended,2019.10.10,2.0
Destiny 2,it's over.,"New player experience is a bit of a mess, but the game is a ton of fun. I really like the fact that there's a LOT of content for F2P players, you don't have to spend any real money to enjoy the game !",Recommended,2019.10.25,155.8
Destiny 2,Joe Swanson,Wife left and took the kids. I was doing Vault of glass Raid with friends i turn my gaming chair and apartment was empty. Still won the raid though. No Vex mythoclast yet. POGGERS,Recommended,2022.08.27,391.5
Destiny 2,Soc,I love playing Destiny 2  I got Godslayer in 150 hours I love playing Destiny 2,Recommended,2024.06.14,455.4
Destiny 2,SAUCY,"Whether we wanted it or not, we've stepped into a war with the Cabal on Mars. So let's get to taking out their command, one by one. Valus Ta'aurc. From what I can gather he commands the Siege Dancers from an Imperial Land Tank outside of Rubicon. He's well protected, but with the right team, we can punch through those defenses, take this beast out, and break their grip on Freehold.",Recommended,2021.03.27,2.0
Destiny 2,TankerTitan,"It's a fun game as long as you don't take it to seriously. As a live service game it has interesting balancing issues and the meta is always shifting. But it can be a blast at times, especially if you have a good group of friends to play with.",Recommended,2021.05.27,640.0
Destiny 2,Dova,Queen Mara sovs boobs very nice,Recommended,2020.11.10,1.0
Destiny 2,LordTriangle,"Can definitely say my time in this game has been well spent. If you enjoy goofing around with mates and the experience of learning new things as well as passing that knowledge on, this game could be for you.",Recommended,2020.10.26,3.0
Destiny 2,Revi,Product received for free  if ya want a bad addiction but don't want to do drugs.... I HAVE NEWS FOR YOU,Recommended,2022.04.02,2.0
Destiny 2,Lord_Obe,i dont want d2 to die.... :(,Recommended,2022.08.26,950.5
Destiny 2,Seven,it's cheaper than meth but will ruin your life just the same,Recommended,2021.12.05,694.5
Destiny 2,Mizkif,its fun for the whoel family,Recommended,2023.03.04,9.7
Destiny 2,King Meow Meow Meow,You can pet a holographic chicken!,Recommended,2019.12.02,218.8
Destiny 2,Sassa,"This game is in much better state than when it was on BattleNet. Lots of additional stuff is unlocked in base, free, version of the game in comparison to BattleNet version.",Recommended,2019.11.30,278.5
Destiny 2,Kaza,"Been playing this game since Destiny 1. Love the gunplay, love the lore, love the style. My main game for 3 going on 4 years now!",Recommended,2019.11.06,1.0
Destiny 2,Shrimp Fried Rice,Everyone should download this game,Recommended,2020.11.12,1.0
Destiny 2,MoistTurtles,one of my favorite games. so many different modes to choose from,Recommended,2022.10.07,1.0
Destiny 2,evilgoat333,i hate this game,Recommended,2022.10.02,2.0
Destiny 2,♿ Pettersson ♿,Good Game,Recommended,2019.11.05,2.0
Destiny 2,Renounced,"Game currently good, subject to change at every DLC.  Brace for impact of Witch Queen to see if it's worth a damn or not.",Recommended,2020.11.11,1.0
Destiny 2,Luuna,It's alright I guess?,Recommended,2020.11.22,8.0
Destiny 2,Homeless so I won't be online :),This game is pain. I like pain.,Recommended,2021.05.13,4.0
Destiny 2,Cayde6FeetUnder,This game has it's ups and downs but it's highs make it a really enjoyable experience. You have to have friends and connections to enjoy this game's full potential though. Playing solo will get dry really fast,Recommended,2020.10.27,704.4
Destiny 2,Matt,its good,Recommended,2019.12.07,3.0
Destiny 2,Willding,Great game to play with others,Recommended,2019.11.27,411.2
Destiny 2,from cow a mars,ou em gee,Recommended,2019.10.09,241.9
Destiny 2,Jobas,It's finally here!,Recommended,2019.10.02,178.1
Destiny 2,ShinsoX,one of my fav games actualy i love it but hopefully they add matchmaking system for the raids not just nightfalls <3,Recommended,2020.07.08,1.0
Destiny 2,[ 4-Eyes ],i love playing nekopara vol. 0,Recommended,2020.07.13,0.5
Destiny 2,C O S M I C,"The combat in this game is so addictive and buttery-smooth, would highly recommend. Love this game.",Recommended,2019.10.15,101.5
Destiny 2,SylverMelody,Much improved from the Activision days. Highly recommend to anyone who is looking for a good looter-shooter,Recommended,2019.10.17,570.9
Destiny 2,hi guys,"Destiny 2 is my city,   Thank you bungie",Recommended,2019.10.02,102.1
Destiny 2,ILLZY,"This is one of the best games i have ever played. It has 3 Free campaigns and destiny's addicting Fps Experience, this is by far the best free to play game i have ever played",Recommended,2020.02.11,890.2
Destiny 2,♠Niceguy♠™,Its good enough for me to get the steam badge for writing a review,Recommended,2022.11.25,2.0
Destiny 2,⌠DEMI-FIEND⌡,It would be the best game ever if there was not the queue,Recommended,2019.10.02,306.6
Destiny 2,dee,if i have to do another overthrow again i will personally walk into bungie CEO pete parsons' office with a Taipan-4FR,Recommended,2023.11.17,231.7
Destiny 2,JJ,"dont come into this expecting an actually free to play game. if you were too late coming into the game for the first time, youll be missing a great deal of narrative context due to this games apparently and evidently horrible management.  the game is incredibly large for a free to play title with seemingly so little to do in it by default, having most if not all content locked behind a paywall.  make sure that before you purchase an expansion (dlc) that the content in the expansion hasnt been deleted and made inaccessible.  that being said, its a lot of fun and totally worth experiencing. the sound design is great and the areas are a great lot of fun just to jump and walk around in. combat feels great.",Recommended,2024.11.04,82.6
Destiny 2,Kaladin,"Incredible game!  Bungie has really made the game way better after parting ways with Activision. This game is one of the best MMO style FPS shooters, if not the best. Might take a while to get into the fun part of the game, the endgame, if you're a new player. The Destiny community is also one of the best communities I've been a part of. You'll always find someone to help you out with raids, quests, crucible and any activity you might want to do in the Destiny subreddit or on the LFG page. This game is best played with friends. If you don't have any friends who play games or play on console, join a clan. It's nice to have some company.  May your light grow stronger, Guardian!",Recommended,2019.12.31,746.1
Destiny 2,Goose,The end of this game will be the end of an era for me.,Recommended,2019.10.12,1.0
Destiny 2,BIRB,warframe is better,Recommended,2021.11.01,86.4
Destiny 2,Major Luzer,"Disclaimer: I have over 2000 hours from the Battle.net days  Destiny 2 is easily my game of the generation. It took over every other game as my daily login. From the community, to the activities, to the gameplay loop, lore... it's all very well crafted. Bungie are masters at what they do, and Bungie right now in Year 3, is a complete package.  I envy everyone that can join us now. Have fun and eyes up.",Recommended,2019.10.02,1.0
Destiny 2,Professor Beetus,"It's uh, still Destiny. Bungie's looter shooter remains the only intersection of MMO loot treadmill and (insert game genre here) that I truly enjoy playing. Their attention to detail means the game mechanics are always a joy, shooting and moving feel sublime, powers and abilities are fun and you can slot some pretty crazy builds once you start collecting exotic gear. The raids are mechanically complex and perhaps the best part of the game, but they do require coordinating six people outside of the game, which can be a pain if you are not already part of a larger social gaming community. If nothing else, the year 1 content is free, so it couldn't hurt to download the f2p version and see if anything about it grabs you.",Recommended,2019.10.26,959.6
Destiny 2,theyboybebop,add sex,Recommended,2022.04.11,23.4
Destiny 2,AKAMA,Good if you have friends else get bombarded with FOMO.,Recommended,2022.11.23,606.2
Destiny 2,Ronan,,Recommended,2023.02.18,210.9
Destiny 2,☁King Beast☁,Product received for free  Best free MMO I've played,Recommended,2019.11.07,31.1
Destiny 2,BootyBandit,Only play if you want crippling depression,Recommended,2023.11.05,2.0
Destiny 2,sqr,Destiny 1 is still better,Recommended,2024.12.14,332.6
Destiny 2,General Killfucker,AAAAAAAAAAAAAAAAAAAAAAAAAAAAAAAAAAAAAAAAAAAAAAAAAAAAAAAAAAAAAAAAAAAAAAAAAAAAAAAAAAAAAAAAAAAAAAAAAAAAAAAAAAAAAAAAAAAAAAAAAAAAAAAAAAAAAAAAAAAAAAAAAAAAAAAAAAAAAAAAAAAAAAAAAAAAAAAAAAAAAAAAAAAAAAAAAAAAAAAAAAAAAAAAAAAAAAAAAAAAAAAAAAAA,Recommended,2020.02.29,2.0
Destiny 2,Zach-O,kinda mid,Recommended,2024.12.14,2.0
Destiny 2,Nxthinq,Titan,Recommended,2024.11.25,765.6
Destiny 2,sunny,"if you want to commit an endless amount of hours to achieve nothing, this is the game for you :D",Recommended,2024.11.22,924.6
Destiny 2,Loganhey,I hate this game,Recommended,2024.11.17,1.0
Destiny 2,HCAkers14,Eater of Time,Recommended,2024.10.20,133.0
Destiny 2,Bob,Stockholm Syndrome- the game,Recommended,2024.09.05,963.0
Destiny 2,semen demon,shut up andrew,Recommended,2024.08.31,247.1
Destiny 2,SilentCastle0,Finally Reached over 1k hours on steam but have been playing since november 2018 officially on this account but I have previous experience in d1 on my xbox 360 . overall this game is amazing but the issue with most games like this is that you need friends to have a more pleasent experience. all the content is fun. the grind for better loot in terms of weapons and armour is almost endless. this is the type of game that you will keep grinding for. dungeons are fun as they are a 3 man activity that offer good rewards and are challenging in their own way. raids are the biggest point for this game with 6 man activities that offer mechanics or puzzles that need figuring out and due to this sometimes it can be difficult if your learning how to do a raid and not many people want to play with someone like that. overall the game is amazing. you can put loads and loads of hours and still not be done with this game and that's what I find amazing about it. I hope you can enjoy it as much as me <3,Recommended,2024.10.12,1.0
Destiny 2,stilus,fun,Recommended,2024.08.22,13.2
Destiny 2,GhostlyWash,"I hate destiny 2, its my favourite game.",Recommended,2024.08.15,202.7
Destiny 2,K0FFE1NE,"I hate this game, it's my favourite game.",Recommended,2024.07.04,2.0
Destiny 2,suisse,destiny too,Recommended,2024.07.04,285.8
Destiny 2,71V3D,я когда нибудь побегаю нормально тут только боюсь что не хватит времени на весь контент,Recommended,2024.07.02,3.1
Destiny 2,DethRaptor,"I played Destiny 2 when it first launched. From the trenches of the Red War to finally entering the traveler and exploring the Pale Heart, it's been such a fun and memorable ride. Thank you for everything, Bungie.",Recommended,2024.07.01,1.1
Destiny 2,Yia,Can only play the game while being on drugs,Recommended,2024.06.29,1.0
Destiny 2,Fluffwaffle,"Good gameplay BUT lots of content locked behind a paywall.  Also, sunk-cost fallacy, what's that?",Recommended,2024.06.17,929.7
