title,id,review_text,recommendation,posted_date,playtime
Destiny 2,Nier,"As for an almost 4k hours to warframe player i can tell this game has some actual ""C0nTeNt"". Jokes aside i've always been wanting destiny 2 to come to steam since it first launched on blizzard and what i hoped for really did come true, when i heard the game was going to come to steam i was so hyped up and even pre-ordered the deluxe edition as soon as i could, i also bought the forsaken dlc and i gotta tell ya ""Its worth the money."". The game is just so enjoyable, especially when grinding for exotics, and quests with my friends, even when playing the game solo i still find it enjoyable because of how the game keeps me busy. Since the game is F2P now, it brings so much more people into the game, which is nice because most gamers love to play a game with a lively community right? The only downside of the F2P i find is that you might encounter hackers in pvp which might ruins your experience but worry not, the chance you get to see the hackers are quite low, this is based on my experience unless you're very unlucky. Anddd thats pretty much it, thank you Bungie for making such a good decision bringing D2 to steam!",Recommended,2019.11.04,1.0
Destiny 2,Ren,"There's always something to do. Whether if it's a strike or a raid, there's always something different. Cayde's story line was my favorite!",Recommended,2019.11.05,2.0
Destiny 2,Bigclappo,Plenty of stuff to do in the F2P version but most endgame activities require the paid expansions. By far the best gunplay available and a ripper story to boot.,Recommended,2019.11.04,480.3
Destiny 2,tripleWRECK,"Destiny 2 isn't perfect but there's nothing else like it. PvP and raids--at their best--are both unique, amazing experiences that everyone deserves to see first-hand.  Addictive gameplay and surprising depth with lots of content and variety of stuff to do.",Recommended,2019.11.04,1.0
Destiny 2,Argyel,"Don't play this game.  THIS IS A ROLLING REVIEW WITH PERIODIC UPDATES. PLEASE READ THROUGH UPDATES, AS SOME INFORMATION EARLIER IN THIS REVIEW MAY BE OUT OF DATE.  Destiny is the pinnacle looter shooter. So much of its content is available for free that it almost makes no sense to not give it a shot. Despite a rough launch, Destiny 2 has come into its own over the past two years, and it now brings the Destiny franchise to the best place it's ever been.  It's enjoyable solo, but if you really want to experience all that Destiny has to offer, you need to bring a few friends. The raids are some of the best PvE content out there in any game, let alone an FPS. Master-level activities are tough as nails, but not unfair. For new players, there's a ton of content to explore, including all 3 year-one raid activities, Gambit, all patrol zones, all Crucible playlists, all strikes, and all forge content.  When you're ready to jump into paid content, Forsaken holds some of the best story content in the franchise, as well as three more excellent raids. Some of the magic of year 2 is gone now, but the content is all still there.  Shadowkeep (and Season of the Undying) thrusts Destiny into a new era, building on the Annual Pass model of Year 2, and is expected to set up a constant feed of content for Year 3. Plenty of new weapons and loot. New, rewarding activities (Vex Offensive drops more loot than you can reasonably deal with), a new raid set in the impossibly beautiful Black Garden, and changes to the way Destiny handles high difficulty that make the most difficult activities in Destiny not only extremely challenging, but amazingly fun and rewarding. Add to that the seasonal Artifact which you can level up to unlock perks of your choosing, augmenting the way you play.  Destiny is stupid good right now. Here's hoping that the rest of Year 3 continues to make this game even better.  Update: Year 3 has not continued to make this game better. But if you're a new player, you'll have a ton to do, and won't start seeing the cracks until you've got a couple hundred hours in. My total playtime across and now Steam approaches 2000 hours, so the issues I see now are issues that you aren't likely to experience for a while, and may even be resolved by the time you hit that point.  Update 2: Season of Arrivals has been pretty great so far. New weapons are very cool, some of them are pretty strong (Falling Guillotine, even post-fix, is amazing. Legendary Dark-Drinker). It's nice to finally see long-teased story beats moving forward. Moments of Triumph has been a boon as well, making 5 of the legacy raids farmable (uncapped rewards per week), as well as guaranteeing those who clear Spire of Stars during this time the best emote in the game. My playtime has skyrocketed during this season versus the last couple seasons, and I'm looking forward to Beyond Light.  Update 3: We're now nearly halfway through Year 4, with the release of Beyond Light, Season of the Hunt, and now we're in the tail end of Season of the Chosen. Year 4 came in hot with a ton of controversial changes, including the ""vaulting"" of all Y1 and some Y2 content, the introduction of weapon and armor sunsetting, and Stasis. Almost 6 months out from the start of the Destiny Content Vault, the removal of Y1 and some Y2 content still stings, if a bit less. They're working on fleshing out the strike playlist, which lost a ton of content, but the effects are still felt in the Crucible and Gambit playlists where map variety is at an all-time low. Season of the Hunt was pretty rough, since the seasonal activity was pretty shallow, and forced players to grind out the core playlists, emphasizing the fact that a ton of content was just cleaved from the game. Trials of Osiris has now been back for an entire year, and while the loot added in Season of the Chosen is very good (Messenger with Desperado, Igneous Hammer), the game mode still has accessibility and stinginess issues, and desperately needs measures to increase the population every weekend.  On a positive note, there have been plenty of good changes to the game in Year 4. Europa is a gorgeous destination, and without a doubt the largest the franchise has ever seen. The weather system feels downright oppressive at times, and it makes the world feel a bit more authentic. Deep Stone Crypt, the raid that shipped with Beyond Light, is beautiful, fun, exciting, and probably the most accessible raid in Destiny 2. If you're going to sherpa new players into the raiding experience, start here. Select Lost Sectors have been given high-difficulty treatments, and are home to exotic slot target farming, which is wonderful. And, unlike with Year 3, FOMO has been lessened by allowing all Year 4 content to remain in the game until Year 5 begins.  Bungie have also been fairly agile in tuning Stasis, which came into the game INCREDIBLY hot. It's still not perfect, as I think the accuracy penalty while slowed needs to go, and Stasis can still win in ways that no other subclass can (one ranged Warlock melee can drop a Thundercrash to the ground like a frozen turd falling out of an airplane), but it's certainly better than the horror show it was near the launch of Beyond Light.  Since the Destiny Content Vault is not a one-way ticket to the void, we've seen a swathe of returning content from Destiny 1, updated for Destiny 2. Strikes like Will of Crota (updated with a ""new"" boss and new name for narrative reasons), Devil's Lair, and Fallen S.A.B.E.R. have returned and been updated with champions for the various Nightfall difficulties which should include them. With these strikes returned, so too has a decent chunk of the Cosmodrome, which is home to the improved new player onboarding experience. In a few months, Destiny's first-ever raid, Vault of Glass, will return, along with the promise of harder versions of raids and dungeons.  Finally, sunsetting has been sunset. A wildly controversial change, sunsetting was a system by which the game would phase out older gear over time. While it certainly had its merits, and similar systems have been successfully implemented in other MMOs, it often negated the drive to grind for powerful loot, since everything that dropped would now have an expiration date emblazoned on its stat sheet. It also left tons of gaps in weapon archetypes and elements for use in high-end content. This works in other MMOs where weapons are little more than pretty stat sticks, but Destiny weapons have quite a bit of personality and players didn't like being forced to break off relationships with their favorites. This system is gone, and while gear which has already been sunset will remain that way, no future weapons nor armor will be given a hard expiration date when they're introduced.  Once again, we're in a place where Destiny is in a pretty good spot. We'll see how the rest of Year 4 plays out.  Update 4: Witch Queen is out. Campaign (played on Legendary) is easily the best in the Destiny franchise, and possibly even in Bungie's history. Don't miss this.  Update 5: I quit this game during the year of Witch Queen. Before the disaster of Lightfall; before several other disasters that would follow suit. Bungie broke my trust for the last time with bugs and greed and laziness two years ago. Every few months some underpaid community manager will tell you about how Bungie ""needs to earn back your trust."" They don't deserve the opportunity. Again and again they betray your trust just to rub their nipples and say ""we're sorry."" Bungie is a shell of the company it used to be. Don't play this. Don't play Marathon. Get an Xbox and play Halo.",Recommended,2019.10.26,1.0
Destiny 2,Sors,I want a big tiddums hive gf to top me,Recommended,2019.10.02,1.0
Destiny 2,Nero,"Destiny 2 has grown a lot since release, so don't let people saying it was DOA scare you away. It is in a great place right now and with the release of New Light there has been no better time to check it out!",Recommended,2019.10.02,2.0
Destiny 2,EcksDee,help me.,Recommended,2019.10.02,1.0
Destiny 2,HayWire25,Its okay,Recommended,2020.11.26,5.0
Destiny 2,tabasco,"Been playing the Destiny franchise since Destiny 1 in PS4 way back 2014 and played Destiny 2 since Beta, I gotta say it really involves you with a love-hate relationship with the franchise. Many things have happened, and disappointments were made in year 1 Destiny 2, and it gradually got better since the release of the Forsaken expansion (year 2), and it didn't stop there, with the announcement that Bungie had cut-off their partnership with Activision, it made the community really happy and now Bungie can focus on what the community wants to improve. Their content from Destiny 1 were slowly put back to Destiny 2 and added some new extra stuff.  And now it finally happened, the Destiny 2 PC platform is now on Steam!  P.S: Crota's End is the best  Update? Edit just for the badge kek",Recommended,2019.10.02,1.0
Destiny 2,Flak,"Destiny 2 is a fantastic game, and since a large portion of it is free now there is no reason not to at least try it. Also, this game is not really similar to Warframe so idk why people insist to compare it to that. In my opinion, this game's gunplay is among the best in any fps I've played, and if you like shooting bad guys this game's gunplay will not disappoint.",Recommended,2019.10.02,1.0
Destiny 2,AkiAndFam,If I had over 1000 hours and didn't recommend this game I should probably be committed to an asylum of some sort.,Recommended,2021.06.03,4.0
Destiny 2,Reyer,You'll get plenty of fun even without the Forsaken DLC. There is at least 200-250h of content before the actual grind starts and until then you won't even feel like you're limited by anything.,Recommended,2019.11.27,201.7
Destiny 2,DEZMOND,For Cayde !!,Recommended,2019.10.02,2.0
Destiny 2,RedVFX,overpriced meth,Recommended,2022.04.18,1.0
Destiny 2,Diet Baja Blast,"Easy Sugar Cookies  Ingredients- 2 ¾ cups all-purpose flour 1 teaspoon baking soda ½ teaspoon baking powder 1 cup butter, softened 1 ½ cups white sugar 1 egg 1 teaspoon vanilla extract    Preheat oven to 375 degrees F (190 degrees C). In a small bowl, stir together flour, baking soda, and baking powder. Set aside.   In a large bowl, cream together the butter and sugar until smooth. Beat in egg and vanilla. Gradually blend in the dry ingredients. Roll rounded teaspoonfuls of dough into balls, and place onto ungreased cookie sheets.   Bake 8 to 10 minutes in the preheated oven, or until golden. Let stand on cookie sheet two minutes before removing to cool on wire racks.  Now you have delicious cookies to eat while you wait for this cursed game to FINALLY give you the weapon roll you want.",Recommended,2021.07.06,3.0
Destiny 2,Coen,"Moving whole Year 1 content to F2P, especially on Steam, gave this game second life. There is plenty of activities you can do with your friends and with daily and weekly bounties there is always something to do, something to discover. Gunplay is great, skills and weapon traits provide an additional layer to building your character and looking for the way you want to play Destiny 2. Definitely worth checking!  UPDATE September 2021  Some time has passed already, sunsetting is also done and new content is landing quite often with bright future shaping on the horizon for Destiny 2. The current state of the game? From a narrative standpoint, it is superb! Really: most of the seasonal games (GaaS) should learn how to approach plot, reveals, characters, and world-shaping. The last time I had this time with seasonal content was back in the Scarlet days in Guild Wars 2. Content-wise it is a mixed bag. We are getting new activities, usually something like a horde mode with few steps each of the seasons (the seasonal arenas) and some small instances for fireteams of three. It was some time already since the new Dungeon was introduced (there are currently 3 in the game) and the new raid (Vault of Glass remake) was opened for players. The last remake of Trials (end-game PvP content) added some life to this part of the game, but there is also a downside - The BattlEye software. Still waiting on the clarification on data collection from Bungie. Adding anti-cheat and not changing tickrate (it is 10 or something) is a little sad, but the priority here was the cheaters, so maybe in the future, we can expect better PvP.  In simple words: I would recommend this game, as there is a lot to do, especially for new and returning players. And there is always that chill and smile when you get your long-awaited god roll (or even exotic item) in your inventory.",Recommended,2019.11.27,4.0
Destiny 2,Ripped Fondue,its a game i love to hate,Recommended,2021.01.10,6.0
Destiny 2,astralbodies,cool game :),Recommended,2020.08.31,7.0
Destiny 2,milk,drink your milk,Recommended,2020.08.08,2.0
Destiny 2,Teius,don't play hard light pls,Recommended,2020.04.20,1.0
Destiny 2,Joosh,its okay i guess,Recommended,2020.03.08,2.0
Destiny 2,亗köniG,Great game. Better than Overwatch or any game similar to this. Fun with friends. It is definitely not free to play though. You have to play to get good gear or do well in PVP. The original Destiny had way better PVP modes. What happened?,Recommended,2020.12.04,245.5
Destiny 2,ogdustoff,"Very fun when there is stuff to do, do not expect women to be impressed with 1500 hours.  Update: 2000 hours still no women  Update: 2500 hours some women have interest but are turned away by my steam library(lesson don't show your steam library)  Update: 3000 hours my skills with the female gender have a far superior power than previous updates, feel as though i could easily get a girlfriend, but I won't even consider unless she'll play Destiny with me.  Update: 3500 hours I have started going to the gym consistently, I am seeing results and I believe the ladies are as well. Wish me luck guardians  Update: 4000 hours gym is currently poggy. I have somehow received a girlfriend. Perhaps 4000 hours is the threshold to get a guaranteed girlfriend. I will continue to give updates every 500 hours, no one will stop me from playing Destiny.  Update 5000 hours, a lot of new experiences, had broke up with two girls i dated, learned a lot, another day 1 completion, finally starting to see results from bulking, Lance Reddick just passed, best wishes guardians.  Update 5500 hours, another contest completion, another girlfriend, going on a date this friday, new apartment, i hope everyone is doing whatever they love most rn. The playing did slow down for a while but with the final shape it'll probably start up again - milk is an s tier drink. Stay safe guardians.",Recommended,2020.08.08,5.0
Destiny 2,Mev,<3 My True Love Game,Recommended,2020.01.02,3.0
Destiny 2,Laila,the most beautiful game i have ever seen,Recommended,2019.11.28,5.0
Destiny 2,Vigg,"Is good game, bang boom",Recommended,2019.10.02,415.5
Destiny 2,†Crimson†,[Insect like chattering],Recommended,2020.11.26,5.0
Destiny 2,Gothicpolar,One of the best games I've ever played .. and now .. ITS FREE! (bet you assumed i was about to whine that a product i paid for is now free like most of the people?)  New age of Destiny has begun and I'm just glad that more people can experience this game and maybe join the community!  Highly recommend everyone to try it out!  See you on the moons!,Recommended,2019.10.02,29.2
Destiny 2,Knoss,this game kinda fun but also kinda gives you depression,Recommended,2019.10.18,3.0
Destiny 2,"d,e,e,t,a,m,e,r",I failed my Jr. year in high school.,Recommended,2021.02.26,4.0
Destiny 2,the player,Product received for free  it would be 10x better with an offline mode,Recommended,2021.08.24,14.4
Destiny 2,The1stTacomaster,SCREEE,Recommended,2019.10.26,381.3
Destiny 2,JacuzziSamurai,kyrile,Recommended,2019.10.03,2.0
Destiny 2,BOKK?,Free to try. Pay to stay,Recommended,2024.10.10,1.0
Destiny 2,chi,"Destiny is everything an MMOFPS should be. Best-in-class core gameplay, tons of activities, challenging PvE, solid PvP and PvPvE, raids, tons of goals to work towards, tons of items to collect, fantastic art and lore, character custumizability, it has pretty much everything.",Recommended,2019.11.22,2.0
Destiny 2,Ryuk,"Um jogão free to play que merece todo o reconhecimento pelos seus acertos. mas que há algumas barreiras que pesam na recomendação - não é para todos e vou explicar o porquê. Sem contar o fato de ser um jogo pesado, ou seja, não são todos seus amigos que vão poder jogá-lo, ele não tem um início amigável para quem nunca jogou antes. Você é largado no meio do nada com várias direções para ir, o jogo não te dá um feedback se as suas escolhas são boas ou se o seu tempo está sendo bem aproveitado. Uma vez que você se ""encontra"" no jogo, tudo muda e passa a ser bem divertido com objetivos claros, logo você sabe o que precisa fazer para tornar seu char mais forte. Há diversos modos de jogo e mapas grandes para serem explorados e as campanhas são interessantes. É bem possível se aventurar solo, mas é recomendado fazer dungeons e raids com amigos, só que devido aos problemas que mencionei pode ser um pouco difícil juntar conhecidos. Mas para quem tem interesse em jogar, fica a dica de insistir nas primeiras horas, logo tudo vai fazer sentido.",Recommended,2019.12.03,30.1
Destiny 2,Robin,"The only reason I gave it a positive feedback is because the game have potential but year after year it seems that the game is going worse. We started the year on a positive note, a new dlc with new content. The story seemed meh over all most of the stuff were reused from previous years but after the story ended it transitioned into a raid which is the main reason I play this game, the raid and its endgame content. After a few weeks a new dungeon was released and it was not really that good, as it took couple of weeks everyone was at high light level but the light level requirement for this activity was really low. Some people even did solo flawless in the first day, which is running the 3 man activity as a solo player without dying from start to end.  I bought the deluxe edition so I had also the seasons with it. As much as I was looking forward for the seasons for new content each season had less to do then the one before it. I expected the first one to be low on content as we had a lot to do with the main dlc but the second and the third lacked also content. The game turned into a bounty simulator as the main activities and the main source of xp comes mostly from them. The current season was the biggest disappointment, we got a public event and a higher level lost sector which is like a small cave with some enemies and a boss at the end as the main activities. We also got trials which sounded good on paper but with all the disconnections and cheater I had to switch on my ps4 to get a ticket done.  In conclusion I don't even know why I gave it a positive feedback maybe because I want it to successed but I am loosing home. We will see what the last season had to offer, I have really low expectation but I also had it for this one and still got disappointed. I am in the edge to abandone the game I spent most of the hours of the last few year on as this is way too much. We willl see.",Recommended,2020.04.04,4.0
Destiny 2,Tagendorr,i hate this game,Recommended,2021.12.22,2.0
Destiny 2,Xeno,I miss my wife and kids,Recommended,2020.12.07,6.0
Destiny 2,Silo,"It's just really gosh darn good, nam sayin",Recommended,2019.10.02,3.0
Destiny 2,Knobollix,"If you like to waste your life with recycled content, this game is truly for you.",Recommended,2020.06.10,1.0
Destiny 2,SwiftEthan,been playing for like years now  pretty good innit  it's still okay,Recommended,2019.10.03,7.0
Destiny 2,Monando,"Very fun game with friends, although it's def recommended to get the expansions on sale for the best content, it's a great looter shooter, only downside I guess would be that most activites are for group of 3 people instead of the usual 4 in these types of games.",Recommended,2019.11.30,74.2
Destiny 2,haku,"Pros: 1. Destiny 2 is an incredibly immersive game that will keep you engaged for hours on end. The story is rich and complex, with interesting characters and lore to discover.  2. The gameplay is top-notch, featuring a combination of first-person shooter mechanics with RPG elements. You can customize your character with a variety of weapons, gear, and abilities, making every playthrough feel unique.  3. The social aspect of the game is great. You can team up with other players from around the world to take on various missions and activities. This creates a sense of community and makes the game even more enjoyable.  4. The graphics and sound design are fantastic, with stunning environments and epic sound effects that really bring the game to life.   1. The RNG (random number generator) can be frustrating at times. It can take hours of grinding to get the loot drops you need, which can be disheartening.  2. The game can be overwhelming for new players. There's a lot to learn, and it can take some time to get the hang of everything.  3. The game can be very repetitive, especially if you're grinding for loot or completing the same activities over and over again.  4. The game is heavily focused on PvE (player vs environment) content, which may not be appealing to everyone. If you're looking for a competitive PvP (player vs player) experience, then Destiny 2 may not be the game for you.  Overall, if you're a fan of first-person shooters, RPGs, and MMOs, then I would definitely recommend giving Destiny 2 a try. It's an engaging and immersive game that will keep you hooked for hours on end. However, if you're not a fan of PvE content or don't have the patience for RNG-based loot drops, then this game may not be for you.",Recommended,2019.11.06,3.0
Destiny 2,FullFl0w,How to have fun in Destiny 2  You don't. At least not anymore.,Recommended,2021.08.27,2.0
Destiny 2,Crazy,its better,Recommended,2019.11.27,244.8
Destiny 2,MarkverseTV,shaxx,Recommended,2021.02.10,4.0
Destiny 2,> <.,"Work hard, play hardlol",Recommended,2020.09.16,1.0
Destiny 2,FeArTriX,Played more than 1800 hours on B.net and will keep going on steam this game is amazing<3.,Recommended,2019.10.02,822.6
Destiny 2,Tess Tickle,Ikora has a really shiny head,Recommended,2021.05.19,776.7
Destiny 2,Cozydonut,"Product received for free  new update is dopeeeeeee......ngl the devs have made it worth the money and time you spend on the game; try it once ,the amazing places and story rich content makes u wanna play this game again and again......best with friends",Recommended,2019.12.03,1.0
Destiny 2,Iceman,"So! It only shows 12 hours currently played, but I have A LOT of hours put into this game... (think last time i checked with it being over on blizzard was around 1200 hours activity?) I have been throught this game through the worst in year 1, all the way into now. So I think I can honestly say that i'm super happy with how the franchise is going, and where it's slowly turning into. This is one of those games where I'll sink like 5 hours into it, and not even realize the time has gone by with friends just doing all those activities with them. Or even running into the random people in the game or LFG, and just having a blast. This community is probably one of the friendliest I've met (so long as you ignore the one's who just want to review bomb cause they hate anything popular), and have become some of the closest friends to date. Thank you Bungie for such an amazing game, and I look foward to seeing the next few years.  Would highly recommend this to anyone who's looking for a amazing feeling shooter, and has some of the best looking gear and weapons to date.",Recommended,2019.10.02,5.0
