title,id,review_text,recommendation,posted_date,playtime
Destiny 2,Lil Thiccburger,it's cheaper than meth but will ruin your life just the same  shoutouts to simpleflips,Recommended,2021.03.22,4.0
Destiny 2,Krooked,Simultaneously the best and most disappointing game youve ever played.,Recommended,2021.02.08,1.0
Destiny 2,mtvpls,when you look down you can see your legs,Recommended,2019.10.05,3.2
Destiny 2,Dami,The perfect description of a toxic relationship,Recommended,2021.11.24,7.0
Destiny 2,Valera Pig Man,Simultaneously the best and most disappointing game youve ever played,Recommended,2021.08.17,299.1
Destiny 2,bonk⁧⁧⁧⁧ Zer0,its like coke but costs more and gives you depression,Recommended,2022.01.08,1.0
Destiny 2,KAMI,Most expensive free game I've ever played.,Recommended,2022.12.14,276.2
Destiny 2,Gremory,They fixed an issue where players enjoy the game,Recommended,2021.02.08,2.0
Destiny 2,orbert,i like it but it needs better new player guidance,Recommended,2019.10.17,3.0
Destiny 2,Reaper,"The game is basically robots, smurfs, and humans being given immortality by a giant ping pong ball in order to fight the forces of evil geometry.",Recommended,2020.11.27,626.5
Destiny 2,NeeKrox,Most expensive free game I've ever played.,Recommended,2024.06.21,13.7
Destiny 2,Samael,only play it if you have friends otherwise suffer in pain like me,Recommended,2020.10.22,3.0
Destiny 2,big mama,Simultaneously the best and most disappointing game you've ever played.,Recommended,2023.04.19,5.0
Destiny 2,Pure Tuah,"I'm sorry, Destiny 2. It's time we broke up. You have ruined my life, wasted my time with worthless grinding, and made me into an addict. Now, I can't stand you without thinking of all of the glorious times we had spent together. Goodbye, Destiny...   I'll see you again in 15 minutes.",Recommended,2021.11.28,1.0
Destiny 2,You Tryhard,This game is great as long as you buy all of the expansions.  It's the most expensive free to play game I've ever played.,Recommended,2023.08.22,112.9
Destiny 2,fat gringo,"The game is basically robots, smurfs, and humans being given immortality by a giant ping pong ball in order to fight the forces of evil geometry",Recommended,2021.08.24,3.0
Destiny 2,chop or be chopped,"This is the greatest, and also the worst game i have ever played. There's just no end to it.",Recommended,2024.10.03,739.1
Destiny 2,stew,free to play but not free to enjoy,Recommended,2022.02.04,3.0
Destiny 2,spctrdemara,"Good decision moving to Steam, and no longer under Activision control.",Recommended,2019.10.06,2.0
Destiny 2,Ч𝓮𝓹𝓗1ль𝓗иц𝓪,when you look down you can see your legs,Recommended,2021.08.07,8.0
Destiny 2,Banisher,"Simultaneously the best and most disappointing game youve ever played, it's cheaper than meth but will ruin your life just the same.",Recommended,2021.04.12,990.2
Destiny 2,Brock Lee,"I hate Destiny, it's my favourite game",Recommended,2021.06.06,1.0
Destiny 2,FlyingCat,We're so back Its so over We're so back Its so over We're so back Its so over We're so back Its so over...,Recommended,2024.04.14,1.0
Destiny 2,CommanderGato,"Free to play, Pay to enjoy.",Recommended,2023.01.04,129.6
Destiny 2,🌻 Raselx007 🌻,i like it but it needs better new player guidance,Recommended,2020.07.14,0.7
Destiny 2,HaloSparten007,its like an ex you can never leave out of your life. Trust me I have tried to leave and I always come back.,Recommended,2024.05.27,3.0
Destiny 2,G1oomyDaze,Its like being addicted to crack,Recommended,2022.08.20,2.0
Destiny 2,"Active ""steme"" user",i like it but it needs better new player guidance,Recommended,2021.08.08,6.7
Destiny 2,Dark Lord,only play it if you have friends otherwise suffer in pain like me,Recommended,2021.04.14,1.0
Destiny 2,Bryan15286,Destiny 2 is so bad. Its my favorite game,Recommended,2022.01.06,1.0
Destiny 2,Lee Sosa,Its not a free to play game its a free to TRY game.,Recommended,2023.07.24,190.2
Destiny 2,BetesNett,I'm in way too deep. This game has taken everything from me and given me nothing in return. Absolutely a pleasure to play.,Recommended,2022.08.02,3.0
Destiny 2,ASM_Alpha,"In Final Shape, the endgame will be that The Witness browses the Eververse store and dies of cringe",Recommended,2023.08.15,6.0
Destiny 2,Im AFK,Nobody will read my review so I will eat 1 tablespoon of mustard for every like this gets.,Recommended,2024.06.02,1.0
Destiny 2,Bedu,Fun endgame content but the start for new players is terrible,Recommended,2020.09.19,898.1
Destiny 2,Bagel Batter,"game's terrible, I play it all the time",Recommended,2020.12.07,5.0
Destiny 2,Tip,"Bungie made themselves a pretty good game. Then, they removed most of it. I will never forget November 10, 2020 when they took away my leviathan.",Recommended,2023.07.23,2.0
Destiny 2,Air,I bought this game full price every 6 months for 4 years.,Recommended,2022.08.17,529.6
Destiny 2,Yoda Muad'Dib,man im still coming back to this game???? monetization sucks gun play amazing content recycled new content so much fun  its like an abusive relationship. Good luck!,Recommended,2022.11.08,1.0
Destiny 2,𝕮𝖔𝖚𝖓𝖙𝖊𝖘𝖘,"I hate Destiny, it's my favorite game",Recommended,2021.09.27,2.0
Destiny 2,Ocelot,"I'm so happy to see over 200,000 concurrent players on steam all enjoying Destiny 2 :) Glad that Bungie came to their senses and left Activision, I hope to see them do well.",Recommended,2019.10.02,938.1
Destiny 2,gospon Fulir,People around the globe praise Bungie for cutting ties with Activisions greed. Well played Bungie! May your light shine forever  Outstanding game,Recommended,2019.10.03,2.5
Destiny 2,nintendo switch,its good cuz i'm unemployed,Recommended,2024.07.01,735.7
Destiny 2,pokevii,damn they really dodged a bullet leaving blizzard when they did,Recommended,2019.10.12,562.9
Destiny 2,*F*P*S*,"Free to play, Pay to enjoy.",Recommended,2023.11.18,17.5
Destiny 2,!Mita V2,This game got me out of LOL.,Recommended,2022.12.28,9.0
Destiny 2,BICC,I am Mentally Ill,Recommended,2021.11.01,4.0
Destiny 2,nona,stuck playing this for eternity,Recommended,2021.11.12,5.0
Destiny 2,Seal,I cant wait for Bungie to lay us all off from playing the game after the story is concluded,Recommended,2023.11.01,1.0
Destiny 2,TJ^,I am in an abusive relationship with this game.,Recommended,2024.03.06,1.0
Destiny 2,NOXUS_FAN,"This game has ups and downs every year, but one thing remains the same. There is nothing out there like Destiny. I love this game.",Recommended,2019.10.08,5.0
Destiny 2,Deku,"Before I played Destiny, I was lonly, had no girlfriend, no friends, I was always the last one to get picked in soccer practice. These things haven't changed, but the game is still pretty awesome.",Recommended,2020.11.03,2.0
Destiny 2,universe,"it's like a dating app, but it just reminds you of how lonely you are.",Recommended,2022.02.21,1.0
Destiny 2,leeki,i hate this game i play it all the time,Recommended,2021.03.05,1.0
Destiny 2,ntтwтtb,"Please Bungie, I can pay you everything I have, just please let us change face appearance after creating character,please I can't handle being so ugly I beg you I need to take my helmet off",Recommended,2019.10.19,1.0
Destiny 2,✪Fluffy Guardian✪,"Only play if you dont have anything else to play, have enough money for the massive pay wall and have at least one other friend to to things with.  if you want to spend your money wisely, just get Elden Ring and its DLC. easily 100 times more worth than this sad excuse for a game i've watched rise and fall.",Recommended,2022.11.23,5.0
Destiny 2,oddmech,"This game is like my ex: Crazy, sometimes gaslights, and takes my money on a daily basis. Trade off? Best sloppy toppy content you love and hate.",Recommended,2023.02.28,1.0
Destiny 2,Ryphin,Product received for free  I like how they got rid of Activision!,Recommended,2020.10.02,51.7
Destiny 2,InfamousBanana,"Why am I still playing this? I hate it, but it's so good",Recommended,2021.05.26,1.0
Destiny 2,Dino MAYONNAISE,I will eat 1 tablespoon of MAYONNAISE for every like this review gets.,Recommended,2024.04.22,1.0
Destiny 2,[A]dmiral [V]ulva [G]angrene,The perfect description of a toxic relationship,Recommended,2021.12.27,1.0
Destiny 2,~Zero,"Game is nice, BUT only if you keep buying the expansions and season passes, and have friends to play with (join a clan!).  F2P experience is very bad, and the game make no effort to introduce new players.  The PvP community is mildly toxic (it's pretty bad, but not the worst comparing with other competitive FPS). The PvE side is a lot better. It's pretty easy to find friendly players to play together if you know where to find.  The story content is getting better nowadays, but there have been quite a few questionable patches every now and then. The devs are very transparent with the patches and communication with their players.  Edit: Nothing changed. Edited for Steam Awards.",Recommended,2021.12.23,4.0
Destiny 2,Revolution InstaGLO R270,Its a trap. i swear.,Recommended,2022.06.11,1.0
Destiny 2,evanf1997,"5k hours and I hate myself, so you should join the suffering :)",Recommended,2023.02.22,6.0
Destiny 2,[EVO]CahillRS,just wish the add-ons didn't cost so much otherwise i would buy them to continue the story,Recommended,2021.06.22,22.9
Destiny 2,Whiskey1dog,"This is a review from a Destiny 1 veteran, written just a few days after the Lightfall expansion has dropped.  Destiny 2 is a first-person shooter with abilities, co-op, pvp, and huge and constantly expanding world. The good parts of this is the best feeling gunplay in the industry, and this is coming from a person who grew up and COD, Halo and tried many, many new FPS shooters to come out in the last ten years. the abilities and builds are constantly changing and powerful, and definitely add to the flavour of the game and truly make Destiny, Destiny. the player versus player is extremely fun, with insane amounts of guns and builds to choose from. Even if Bungie does occasionally screw the balance horribly, but that adds to the experience to an extent. If you want amazing gunplay, awesome and cool abilities, outstanding co-op AND good pvp (although not as big of a focus as the co-op content), then Destiny is definitely for you.  but where are the downsides? I'll tell you. I would say Destiny 2 is an ""easy to learn, hard to master"" type of game. Bungie has put lots of effort and resources into improving the new player experience, and in Lightfall, I think they have finally made a ""good"" new player introduction system. D2 is intricate with many layers of lore, gameplay and buildcrafting, and quests that can overwhelm new players with all the content, with no where to really know where to start. Lightfall's changes only partially solve these problems. Other problems include PVP content draught, FOMO, and no in game LFG system (coming later this year), although Bungie has partially alleviated these problems with Lightfall and previous changes, they are still definite problems the community wants fixed.  Destiny 2 is a great, incredibly fun game especially with friends and I'd recommend the game to anyone who wants THE BEST fps mmo game. impeccable co-op (amazing end game, not like anthem), great pvp, and awesome gameplay. even with the problems new players might have without a friend to guide them, and the other problems I mentioned before, D2 is a fun game with near limitless potential to grow and become better.    You may have heard very negative feedback so far about this expansion. The critiques the community has for the DLC are completely valid and I overwhelmingly agree. The campaign, while fun, was a narrative letdown. However, the quality of life features, the new subclass strand, the difficulty overhaul and seasonal model changes are definitely positive. If people ignore the campaign, I'd say lightfall so far is a very good DLC. as someone who played shadowkeep and beyond light, Lightfall is better. On top of that, beyond light didn't stop evolving and adding content in the first week. After the raid was beaten new content and exotics were released, so I assure you we have definitely not seen all of Lightfall just yet.  This is my first review I have ever put effort into, so I truly hope you enjoyed and found this informative.",Recommended,2023.03.05,3.0
Destiny 2,Corid,"relationship with wife over, new relationship with Luke Smith. nothing has changed, except the type of pain I experience",Recommended,2020.10.14,1.0
Destiny 2,Milena,After a bit more than 180 hours I feel like I haven't even scratched the surface of this game. I'm liking it way more than I thought I would.,Recommended,2019.11.27,249.4
Destiny 2,Vet,"Updating my review as of November 27th, 2021 to reflect my views as a D1 Alpha Veteran (not some random clown): I hate this game. I play it everyday.  Updating my review as of November 25th, 2020 to reflect my views as a D1 Alpha Veteran (not some random clown).  After divorcing my wife and quitting my job to play Destiny full-time, I have got to say that 10,000 hours in I am enjoying myself despite my deteriorating health. My doctor told me that this is an ""addiction"" so I told that clown to stick to medicine.  All in all, this game is wonderful. Truly one of the greatest franchises of all-time.  Note: I have uninstalled this game at least 300 times, but somehow it still gets me.  I do not recommend.  But I do.",Recommended,2019.10.02,6.0
Destiny 2,Gnutty,"Get Gun, Use Gun, Suffer In Crucible. Repeat",Recommended,2022.05.29,2.0
Destiny 2,XELNEO,"I hate this game so much, it's one of my favourites.",Recommended,2022.04.03,1.0
Destiny 2,Felipovysk,Stockholm syndrome describes the psychological condition of a victim (me) who identifies with and empathizes with their captor or abuser (Bungie) and their goals.,Recommended,2024.01.22,4.0
Destiny 2,Old Man Jerome,developed anger issues from this game,Recommended,2021.09.04,491.1
Destiny 2,Strudelmaster56,I hate it but I can't stop playing,Recommended,2021.09.08,183.4
Destiny 2,i report meta,I want Mara Sov to stomp me,Recommended,2022.01.29,786.0
Destiny 2,Shadow,It's like crack. I know it's bad but I am still addicted to it,Recommended,2021.02.08,129.4
Destiny 2,Dale,"Fun core campaign, beat it when it first came out now I'm replaying it on steam.  Sadly most of everything else is behind a pay-wall.",Recommended,2023.08.23,13.2
Destiny 2,(´･益･｀*),This game gives you depression,Recommended,2021.09.30,975.4
Destiny 2,Void,"Sure, I recommend the game only if you wish to experience an abusive relationship, that is.",Recommended,2020.03.12,4.0
Destiny 2,Livin,sunset Luke Smith,Recommended,2021.01.26,4.0
Destiny 2,Hungolomghononoloughongous,"Its like getting kicked in the crotch at mach 11 and then going please may i have another. I think i got a problem here.  -edit- So i kinda retired from the game. Its like a malicious cycle that pulls you back in and really while it feels it rewards the time you put in the time is always hours and hours. The saying ""imma hop on destiny for a few and do a few things"" is always followed with hell its 8 hours later and you still haven't even completed the one thing you wanted to do; followed by freak i wanted to hang with x group or play x game with x people. While i do love the game and everything it just cannot be my second job. Friends know my primary one keeps me up at all odd hours. but i rather enjoy the game for what it is and not how it should be played and what is the meta. Enjoy the game but don't dive deep it sours the game and makes it un-fun. Take your time and honestly to hell with the meta. play what you enjoy and make it your game.",Recommended,2023.04.29,6.0
Destiny 2,RazorEdge,Best reskinned-weapon farming simulator i've ever played,Recommended,2020.02.27,388.7
Destiny 2,Krouter,help,Recommended,2022.12.26,5.0
Destiny 2,coronadojoe,I hate this game,Recommended,2021.07.16,3.0
Destiny 2,BaRnAbY,"i hate destiny, i play it all the time.",Recommended,2023.02.05,1.0
Destiny 2,Guakstick,This game could beat me up in a Tesco parking spot then charge me for the damages to its fists.  I'd probably still pay up.  Highly recommended for addicts.,Recommended,2022.01.20,6.0
Destiny 2,dr0pzz_,i miss d1,Recommended,2021.07.14,296.2
Destiny 2,Shadow,"Moving from platform to platform, I can easily say Destiny is the game you love to hate and hate to love. Like being in a relationship. Those moments when you know you should walk away, but you don't. Instead you keep going back for more. Sure there are plenty more games in the store, but this game, oh this game gives you good times. As long as you're happy to keep paying for content, just like you would with a.. well.. you know.  In a game full of cheesey bugs and over powered weapons that get nerfed only to get buffed again later on, there's nothing quite like teaming up with your mates to stretch across the galaxy, kicking ass and taking names. Names of all the cheaters who you can report to Bungie for them to ignore.  You'll be greeted by the kindest of people with random dance parties at the social space, while also getting their tiny tea bags after they one-tap headshot you with some absurd weapon they 'earned'.  But hey, if spending hours grinding your ass off for mediocre loot that will be useless within months while breaking your peripherals is what tickles your pickle, then I will see you on the battlefield.",Recommended,2021.05.03,1.0
Destiny 2,Forfeit ⎾♥⏌,I haven't had this much fun with a game in years,Recommended,2019.10.25,4.0
Destiny 2,BlackNinja_360,would be nice to have old planets back...,Recommended,2024.03.02,1.0
Destiny 2,Boromir,"They fixed an issue where players enjoy the game. Free to play, but not free to enjoy.",Recommended,2023.03.07,36.4
Destiny 2,⛧ M♱ropele ⛧,Did you grow the playerbase? Bungie: Yes. What did it cost? Bungie: All of our server space.,Recommended,2019.10.02,71.7
Destiny 2,Queen Of Hunting,played the game when it very first went up on battle.net. got pretty bored soon after finishing the campaign back then.  seems like theres a hell of alot more things to do now (and that isnt just because of expansions since either)  gunplay is very much top end on the scale for shooters and i highly recommend anyone who is on the fence to jump in,Recommended,2019.10.26,121.4
Destiny 2,Aids Plays,It's okay I only played it for a little bit but i think its fun,Recommended,2024.05.18,3.0
Destiny 2,Fender,"Im legit convinced that noone actually likes gambit but only plays it for the quests, bounties and drops",Recommended,2020.06.02,2.0
Destiny 2,okrami™,"this game sucks but its fun, weird relationship",Recommended,2020.11.10,124.1
Destiny 2,MimicTree,Good,Recommended,2022.01.11,33.0
Destiny 2,the missile knows where it is,"I own a hand cannon, since that's what the traveller intended. Four dregs break into my house. ""What the devil?"" As I grab my ace of spades. Blow a golf ball sized hole through the first dreg, he's dead on the spot. Draw my golden gun on the second dreg, miss him entirely and nail a cabals' war beast. I have to resort to the rocket launcher mounted at the top of the stairs loaded with a cluster bomb, ""Tally ho, lads"" the missile shreds two dregs in the blast, the sound and extra shrapnel set off sparrow alarms. Pull out a knife and throw it at the last terrified fallen. He bleeds out waiting for a servitor to arrive. Just as the traveller intended."" Silvaks-28",Recommended,2022.08.27,1.0
Destiny 2,ManOfGlas,"I hate this game, play it every day.",Recommended,2022.10.24,1.0
Destiny 2,FBI Agent F,I hate Destiny 2. It's my favorite game.,Recommended,2021.10.19,3.0
Destiny 2,Ace of Spades,"Ive been here since the beginning in the destiny 1 beta, ill be here till the end. Dont play this if you have a life",Recommended,2021.02.24,540.6
Destiny 2,Karnagezzzz,Screw Activision !,Recommended,2019.10.02,22.8
Destiny 2,pouringthunda,"I have over 800 hours in Destiny 1 and It was like my favorite game of all time. When Destiny 2 came out under activision it didnt feel like the same game but it was still fun and played it for about 200 hours and it lost my interest. Now that Destiny is free from activision it feels absolutely amazing, this is the Destiny I fell in love with. Minus the server issues that they are trying to fix I really recommend this game. At least give it a try since its a free to play game now, you cant go wrong =D",Recommended,2019.10.05,125.1
Destiny 2,DeuS,The perfect description of a toxic relationship,Recommended,2024.04.19,0.1
Destiny 2,Gunny,Fun and challenging for both you and your PC.,Recommended,2024.06.15,77.9
Destiny 2,rev,one of the games i've ever played,Recommended,2022.09.19,1.0
Destiny 2,Engen,This game should be classified as a drug. also i would write a longer review but... these god rolls wont farm themselves.  ------[UPDATE]------ Help.,Recommended,2020.12.09,1.0
Destiny 2,macdonsoccer,"I hate this game, gonna go farm more gms now",Recommended,2021.12.03,1.0
Destiny 2,Obi1Jacobi01,I haven't learned how to play any other games,Recommended,2024.04.07,3.0
Destiny 2,Baba,"IKORA, I'M TRYING TO MAKE MY WAY THROUGH THE THRONE WORLD BUT I'M DUMMY THICC AND THE SOUND OF MY ASS CLAPPING KEEPS ALERTING THE HIVE",Recommended,2022.02.22,4.0
Destiny 2,xMarkxz,This game gave me crippling depression,Recommended,2022.05.22,1.0
Destiny 2,CircusFreak123,Don't play it.,Recommended,2022.09.04,1.0
Destiny 2,zola,hate this game,Recommended,2021.04.29,1.0
Destiny 2,Alive Man's Tale,hot exos,Recommended,2021.11.26,4.0
Destiny 2,Curleefry,RIP Lance Reddick; WARP SPEED DON'T RAINBOW READ ME,Recommended,2023.03.18,251.5
Destiny 2,Geekwad,"I know it says Free To Play, but in reality it costs so much more. It's cost me my fiance, career, sexy physique, free will, and now the only way I'm able to play is outside the local Crayola store where I feed on children's scraps as they throw away broken crayons.",Recommended,2020.09.08,1.0
Destiny 2,Gamebred ◢◤,Needs a flying knee finisher.                  I'll pay 3 piece and a soda for it.,Recommended,2019.10.02,754.1
Destiny 2,Misuto,I hate myself more than i hate this game,Recommended,2024.05.16,458.7
Destiny 2,DK...,daily routine of a Destiny 2 player  Wake up eat turn on computer launch Destiny 2 sit in orbit for 30 min realize no one is on close the game sleep,Recommended,2022.12.07,2.0
Destiny 2,davidsyana,i hate this game,Recommended,2021.12.09,3.0
Destiny 2,Shinzo Abe Funko Pop,i showered once but destiny fixed that,Recommended,2023.03.09,282.3
Destiny 2,✞𝓡𝓮𝔂✞,"If you seek the means to live to your potential, I can guide you to it. There is a power in this universe beyond your feeble Light. I leave you with those words, and these parting gifts. Take them, and grow fat from strength. Emperor Calus has spoken.",Recommended,2022.06.17,822.9
Destiny 2,name,help,Recommended,2021.09.17,2.0
Destiny 2,DisTroyal,"It's my favourite game, I hate it",Recommended,2022.04.08,1.0
Destiny 2,himejoshi,be gay in space,Recommended,2019.12.02,714.7
Destiny 2,happiness,"2020's been a great year for bungie, they're now selling content removal tools marked as DLC",Recommended,2020.11.27,300.1
Destiny 2,Reaper,Better than Anthem.,Recommended,2020.10.16,380.6
Destiny 2,_Biped,this warframe update is kinda weird,Recommended,2024.04.13,288.5
Destiny 2,🅉🅄🄼🄿🄻🄴,I want Mara to sit on me,Recommended,2022.01.17,0.4
Destiny 2,super mario,Someone play with me all my friends hate this game,Recommended,2020.06.11,1.0
Destiny 2,Gamebriel64,i hate my wife,Recommended,2021.06.15,713.8
Destiny 2,Anime Titties,"Your wallet is the true guardian, can't do much without it.",Recommended,2023.08.28,312.3
Destiny 2,Number_T,Mountaintop is gay,Recommended,2020.09.29,5.0
Destiny 2,dingle smirp,its ike crack,Recommended,2024.05.25,461.9
Destiny 2,Airin,Follow the rules and follow the guidelines and you too can have a hobby controlled by a corporation.,Recommended,2023.07.21,336.9
Destiny 2,Kyoundere,slide shotgun melee slide shotgun melee slide shotgun melee slide shotgun melee slide shotgun melee slide shotgun melee slide shotgun melee slide shotgun melee slide shotgun melee slide shotgun melee slide shotgun melee slide shotgun melee slide shotgun melee slide shotgun melee slide shotgun melee slide shotgun melee slide shotgun melee slide shotgun melee slide shotgun melee slide shotgun melee slide shotgun melee slide shotgun melee,Recommended,2023.04.16,4.0
