sentence,topic
outstanding moment stepped immersive world blown stunning visuals rich futuristic universe present attention detail environment character design remarkable nothing short phenomenal fastpaced action fluid movement acrobatic combat mechanic make mission thrilling exhilarating experience im slicing enemy nimble ninja unleashing devastating power powerful space wizard moment feel empowering satisfying standout feature depth customization offer extensive array warframes weapon mod allows endless combination ensuring player tailor playstyle perfection constant update addition developer keep fresh exciting giving something new explore master aspect appreciate supportive welcoming community teaming coop mission seeking advice player ready lend helping hand sense camaraderie add whole new layer enjoyment set standard freetoplay game providing incredible amount content sacrificing quality mix intense action deep customization everevolving world keep coming confidently say best gaming experience ive recommend anyone seeking epic scifi adventure vastness space,5
doesnt need review check gameplays gooood feel playing friend solo thing liked pay purchase stuff dont payjust grind enough get wanted wanted gauss warframeand dont think get time sooner yea keep grinding thats gift possible xd wanted pet mom doesnt space alien doggo invisible ability pet ahahahahcute doggo rest everything fine graphic story cinematics action boss everything awesome,-1
recommend ppl gb download hugh worth u download u enjoy min u stop bec u like u friend,-1
product received free time spent grinding using cash biggest wall casual player lot thing crafted lot mixup combined equipment recommended love rng grinding repeated dungeon action farming,-1
,3
fun easy get hooked clue getting fun chaotic good luck fun,27
nicee lotus titty screen ty,2
best played u wont regret getting free,14
couldnt ask aaa company cant recommend enough pinnacle free,10
best shooter looter time best thing much content run thing,-1
played past decade evolved simple rd person shooter something diverse expansive recommend anyone interested rd person shooter super smooth monetisation fair everything free thing say affect slot frame weapon trade premium currency get free patient look someone buy mod part want trade spend fair amount money considering playtime say money spent went cosmetic kept invested interested long time new content get added regularly includes new weapon frame new story related quest,-1
best free available bit grinding make enjoyable,1
seems good need hour make final decision,2
best free game,14
think wonderful story cease amaze new open world beautiful,11
fun leaving house long time keep entertained,15
ah thats good,4
,3
good experience love,18
good,4
good much update,-1
abit grindy buts fun animation cool attack skill dope enjoyable,-1
yes,25
realised addictive get friend combat variaty weapon favourite part customisation pretty impressive weapon modding dispise lot people saying game pay win platnium premium currency obtained trading item player obtain,5
best free,10
playing scifi game playing game good friend,16
fun free rly nice sleek aesthetic oh god aesthetic rock world great fun bullet jump ton warframes use numerous playstyles cool story character listen free,-1
liked coop friend able customize tenno pretty cool,8
free good graphic good ask,11
best game played pay win gain anything market void mission sell prime part,-1
combination third person shooting fun melee combat deeperthanusual rpg element lot customization wealth map explore rough patch overall solid fp closest thing get resembles pc,16
good perfect trade system good battle system perfect graphic wide range weapon wide range class isnt full value rpg element lot class improve higher lvl multiplayer guy pve pvp pvp pvp system need improved fight v guy clan need duel room v place planet balanced conclave indicator collness improves getting new better item good recommend people action rpg game,-1
thought require use real money make worthwhilebut ive playedthe realise dont need spend money fun gamei recommend everyone want fun spending money,-1
seems good dont think ive enough time write proper review update review,-1
good time beginner enjoyed week getting bored,-1
mean world helped many hard time helped find build relationship many people unique indepth customization system stunning seen many review people played thousand hour recommending bad mouthing find review people valid bit frustrating numerous issue small persistent bug including big bug major release tend get patched update loop bit grindy point valid make sum whole negative experience problem problem ignored understandable de developer shine striving innovate improve experience de dedication fan cease amaze care player trying whats best sometimes fall short mark personal recommendation enjoy try player ignore flaw understand let undermine crafted thing lonetraveler,21
beware wall text incoming started playing week im kinda new whole thing got ta say love scifi action get rating awesome right beginning youre freakin space ninja damn mighty described similar mass effect focus lot pure epic action coop youre going able slash dozen enemy friend great due fact arent many coop let look pro con pro epic graphic find standing enjoying great visuals great programming concerning perfomance able run high detail mediocre setup exciting fastpaced coop whole lot content several planet different mission type ton weapon warframes extra mission accsess crafting key able join form clan build clan dojos point id highlight dojos cool feature build kind different room dojo including lab duel room obstacle course beautiful decoration room japanese theming awesome planetarium stuff great fluid gamefeel perform several move wallrunning dashing backflipping everything youd space ninja fair fp concept everything accomplished spending real money excluding additional itemslots cheap cosmetical item item supercharge weapon warframes developer great guy give feeling care got many detail feature wouldnt need make better thought earlier mentioned clandojo big example dat patch redtext played bit know mean pro let get heavy people con con buginfested main chat love freeze time time ui get stuck mission wont start many problem appear id say kind bug dont make unplayable get nerve take fun devs got ta something time serious amount bug shouldnt present get repetitive due fact mission repeat thing new planet level tileset different ressources able obtain grind grind grind whole based grinding farming ressourses able craft new weapon warframes key access orokin mission bad thing depending type player big deal grinding freakin fun thanks action packed game lost interest collecting th kodo wiener sooo here tldr great full action ton content give feeling devs care player hand get bored damn due repetitive amount grinding order craft new item depending type player going ton fun going quit hour saying jesus boring written thing left say,7
good free active devs lot fix big update month beat many nonftp game edit year wow developer team let word updating massive plus inspire devs take similiar action making everything perferct thing massive grind littlle bit rng someone done allmost everything many hour spending time universe kind okay end defines jorney jorney fun thanks active devs jorney continues end fashionframe matter,21
great,6
awesome nice graphic new featured brings fun,11
good,4
favourite game ive played pc played early day say time grindy aspect game get much ill stop playing time seem come due developer constant update fun getting prime part youve wantes age running mission mate cease entertain overall recommend anybody willing get slow start,-1
thing something keep bringing fact get unlock cool weapon character keep playing losing mind way cant go wrong free,-1
best scify seen graphic awsome recomend free take gb awsome dont think anybody give negative get,11
good time know youre getting grindy dont mind core solid enjoyable albeit snag warframes suit darn playstyle frame get choose beginning reflect well weapon acquired spending cent grinding come patience course dont patience buy platinum spend warframes weapon various cosmetic goody,-1
good get bit repetitive level design world seem similar ninja movement fun experiment isnt tutorial tell individual jump way good others recommend anyone who ninja mechanic tps,9
yeah pretty decent kinda hard get little grindy nothing compared runescape fun friend favourite aspect art direction digital extreme listening player make healthy friendly community give go havent,-1
,3
yep nice update unbelievable fp nice,-1
great get time edit alright kind,2
best coop game buddy badass ninja parkour get kill random enemy,8
best paywin fun good interisting grind best free right,1
nice friendly community,-1
space ninja real weapon diverse character different stay fun late improves time best free game made,9
repetitive amount character build weapon mixed quick fluid session make fun collecting frame weapon completing story decking ship furniture breeding cat there something played steam remains top played steam good reason,-1
product received free updating review playing tremendous change good bad ill try give unbiased opinion total fan boy try best simplify everything question happy reply review time fresh new player super fun mission dad started playing word hour hour devs throw wolf point lost interest problem new player experience mechanic confusing weapon mod character mod hard understand weapon damage increased time effect stat hell status effect community guide howto forum video place look walk throughs year willing learn isnt impossible upside endless content close hour get end start get repetitive mission feel content seems lack luster short get point everything okay sound dogging let clear played younger going school pretending stay ive made life long friend ive lived entire life people met ive seen people come go ive seen friend get married kid get great job passed wouldnt trade world getting community easy meet new people awesome community people live breathe people help question dont afraid ask someone willing answer question content find invested hour hour thing keep going friend talk kill thing awesome long story get try talk people enjoy worth download want want help shoot message im playing willing help new player hope helpful hope see,7
,3
grindy good welcome,1
becoming played general enthralling experience keep beguiled exhilarating paced combat miss beat tight responsive control give absolute control space ninja enjoy customization perfection dozen color palette different armour weapon variation different powerup modification allow spice personal input surface seems paytowin assure easy carve path spending single cent recommended,-1
amazing dont know free patience love farm great try,19
fun enjoy minute get repetative love community friend ive made make worthwhile,-1
good,4
whats awesome space ninja,9
good,4
fun friend stay fun becasue get preaty linear thing veary paced lot shiny ability recommend people liitle time prepared pay stuff dont spend money get playing need time said overall good,27
great dont grinding playing story fun remember modding equipment arsenal key getting stronger community average helpful new go big guy grind story force big guy go level walking new guy threw endgame fun,-1
fun,15
fun wide variety warframes different ability playstyles,-1
love compleated second dream quest realy got super adictive repeditive scifi geek,-1
,3
,3
thank kanye cool,17
best game ive played thats kept coming year free,14
love time,18
better,17
seems good,20
hour good wtf,2
cmon space ninja crazy customization need download wont regret,9
awesome,6
great gamplay epic story bautiful artwork justepic grindingtolerable hacknslash shootor explosionsor arrow fireball lightning bolt sonic attack orsoul punch settle invading enemy mind making kill many weaponsnot kidding fit playstyles know space ninja cmon guy space dont space ninja space cowboy girl dont space wizard space ninja space dog lazers giant lazers plenty lore bobble head recomend plenty explore try new weapon gear added,5
good,4
love basicly everithing ecept fact see coming bit playing high amount lore related content lot character call warframes updated best partits freeand better xd,-1
,3
amazing,6
list requirement awesome year favorite recoment everyone,-1
amazing free hour evolving good amount downtime update amount weapon thing collect dojo build clan join friendly community there reason ive put twenty buck early slot weapon slot ive made needed selling item ingame great market got ta keep price,-1
great freetoplay experience respect enough understand wide variety system bogging experience long introduction explanation enjoy experience working long hard towards goal improving shooting thing jumping lunatic,-1
requires bit time get lot fun,2
ggame amazing,22
yes,25
get better everyday congratulate devs time launch there great new content everyone enjoy course free check im sure wont disappointed,23
best fp ive played,13
best fp game get hand full content great,13
alot grind alot fun amazing graphic sound great coop host migration get annoying superb open world part ton weapon warframes addons cosmetic pet sentinel quest side quest storyline thumb mastery rank test gon get mad angry rewarding progress higher rank trading improved functional point work issue work old pc thats big plus want go open world part gon need stronger pc ram better gpu free recommend item mall use optional get free buy store real money grind needed alot trading mine mineral gem fishing alot crafring mod ingame mechanic single piece equipment get hand get wont know much stuff,5
enjoyed bring friend hard solo plenty people join want go public nice graphic coool environment lot way collect build equipment competitive spending cash found hard tolol controller issue started playing mine working great definatey recommend,8
fun free great story many different weapon unique effect different warframes choose prime variant get weapon warframes free specific quest farm boss mission overall great fp,-1
slaying grinding everything sight thats enjoyable thing many possibility fp amount content get huge thats reason im coming get bored old comeback good left friend make playtime started learn advise give take time read understand everything dont rush going work,-1
awesome time consuming worth,2
hell haha fun true,15
wan grind welcome grindspace need budge ofc good,1
best free played nice graphic great story hole time,11
best game ive played spend hour playing reccommended,22
best freetoplay multiplayer ive experienced perfect pack insane amount content depth obvious paywalls provides enjoyable loop enough variety boast unique consistent visual style market fell love provides high quality coop experience id recommend everyone atleast check free everything tie basic loop grinding mission level gain resource there something upgrade strive forward there genredefying optional content fishing petbreeding single player quest keep interesting long time enjoyed optional content shouldve snapping picture rare enemy type impressed many interesting design hundred weapon warframes game literal timesink player co op face challenging mission negative footnote tell built top way suffers confusing ui design ancient progression system turn newcomer guidance feel there lot done streamline experience sacrificing depth overrall,8
love grind early think comparable payday come root levelling getting money take level get bored weapon resetting level sell make new weapon course devs took opportunity put micro transaction regret money spent much fun,-1
cool,6
decent,20
best slide simulator ive played,19
year old updating patch know good hand reason alive kicking great graphic improvement great story singleplayer cool coop way fun try started year give go good old,-1
ive playing longer say steam take hiatus come fun played thats small accomplishment give try fall love,-1
third person cooperative freeplay action strong scifi theme emphasized fastpaced gunplay melee combat like stylish nice style unique aesthetic lot cool stuff zipping level high speed spinning air whirling tornado blade death maxpaynestyle bullet jump dualwielding assault rifle large expanding selection weapon ability use something everyone want dual sword sure giant hammer course machine gun slice enemy piece shotgunaxehybridthing yeah game got large potential optimization different build certain please people like get number customization option impressive paying cosmetic good number option make character look way want change color everything including hub area space ship good number cosmetic obtained playing h kept motivated throw new thing new weapon craft try access feature different mission type point nice good number system make meat explained want get read environment generated precreated tilesets blend get bit samey recommend switching different planet break bit nature beast relies grinding gear replaying mission doesnt bother much im sure people put playing mission time row get something abundance piece need played solo part enjoyable group starting midgame difficulty begin ramp think freeplay model executed fair keeping purchase optional many item item shop priced least opinion make money id spend time playing enjoy spending lot money shortcut said number priced item shop enhance experience bit want deal course possible get premium currency selling rare item player example dont spend money dont want enjoy bit continue cant beat stylish space ninja lightning gun fire sword turn quite lot fact review written year day time writing plain eidolon update recent patch say made take break new area lack much everything make great add lot unnecessary garbage departs kill stuff awesome possible formula sincerly hope take criticism kind content heart cosiders future path turn whole plainsstyle large map rep grinding fests lose space ninja magic major open world content update dropped fortuna seems decided going evolve point find sad fortuna orb vallis surronding area time better plain eidolon turned opinion good fan focussing open world content improved way approach bit area lot interesting brown grey mess mission type annoying much added stuff integrates rest community seems love new hoverboards think anybody remember ninja said great come recommended everybody enjoys ninja fun weapon making crazy build murder fool,7
launched content polish ton fun enjoyable moment big ui update coming couple week get playing update,-1
loooooove best game played,22
space ninja kill zombie alien robot looking tottaly badass reminds vindictus diabloish style loot system instanced mission cutting people half beta alot fun return steam paywin unlock frame mission crafting update amazing come recommend friend,9
im founder favorite pc game beginning beta version didnt steam downloaded site best friendliest community meet amazing people year played course rotten apple thats grind got ta work material platinum used buy anything market ingame credit need want build something trade resource needed make weapon warframes take time hour youre great team chatting time fly graphic great bump devs p overall think fun amazing people someone elses cup tea say give shot see updating something new,29
awesome many different style try,-1
best action shooting,-1
better high spec pc,-1
free game wide range story mode integrated open world environment graphic pretty awesome free,11
wonderful easy lose time stunning eye candy custom coloring skin mod custom build customization option ive played worth least try everything farmed ingame grinding hard use plat purchased real money needed dont guy walk something thats perfect finding want year take hour download give try youll surprised p,-1
epic good unspeakable joy cant go detail experience understand youre skeptic free nothing lose anyways,-1
idea im love much,18
pro core loop dope lot different weapon ability good gunplay third person doesnt give everything good start come good lore story great sound design look good thing dont require lot grinding place community best good interface satisfying large update load content devs open communty feedback taken account fan created skin get said fan given cut profit con lot grinding general thing require lot monotunous grinding bad new player experience working wait time weapon frame real end goal update bit rare customer support slow time amount thing overwhelming hard challenge sum isnt everyone hard get hard get,-1
awesome,6
good good recomend,-1
best fps tf dota,13
fun,15
superb free able pump endless hour downloaded fell love best free experienced,10
good wife left got frame tho joke spent money plat didnt get dime divorce,22
cooperative third person shooter involves strange blend melee combat shooting parkour weve gotten standard way good good meaning pro con come pro graphic quality amazing freetoplay everything stay difficult harder youre supposed know friend starting time parkour system smooth easy use new tps player last time reviewed changed whereas scared make new weapon due credit resource restriction ive found resource common case ive free experiment gun find one latron love ya baby set cleaver hammer machine gun rifle shotgun several sword list go best part though credit achievable ive able experiment fear losing much way earn warframes changed much whereas chance spawn th moon youve sacrificed firstborn guaranteed get frame part fighting bos drop ive coughed plat warframes provide incredible spin forcing change playstyle frame course ive got favorite nyx love ya baby frame refreshing take renews continue level changed level change style depending who control planet course planet alot begin notice level expected tad grindy time several friend found beginning hurdle quit early due upper level carrying low level making boring youre going enjoy necessity dont public matchmaking player tend rush level allow lower enjoy get kill matter youre going need friend recommend provided youve got friend zombie chicken,7
gud gam,24
great grind,1
perfect people farming lot customization,19
awesome gamelove completley addicted,30
awesome great time pas lot fun playing,2
year awesome free ingame credit able earned grinding nice graphic update lot weapon ninja able fly space ninja style customizations character pet ultimate ninja skill bloody warship,9
excellent character design excellent environment design excellent engine impressive effect good sound design movement programing neat generated level various type mission online coopmultiplayer linux support grinding way overblown many time consuming time locked event item way expensive mission map navigation confusing cant mission nobody playing impossible linux support,5
take bit grind get going fun mob shooter end lacking devs updating keep getting better month,-1
paytowin easy earn way community league better paid platinum give hard work put experienced glitch last night fine lasted couple second voice acting youd expect graphic quality great type youre given tell consumer point view model nice freeflowing ninjaesque fun stealth achievable go option gunsblazing overall great piece technology finest community willing help new player challenge get good call expert tenno youre thought downloading free addendum hour sentence terrible worded pay progress everything earned grinded besides tennogen community made item sell actual money royalty go community member made,-1
good havent played tho,2
free best go,10
bit complicated hard get continues best game pc considering free im shocked good gripping story plenty action keep coming new open world area,-1
good get repetitive dont go way put variation mission quest huge amount content good couple hour hundred thousand,-1
highest quality fps made staggering amount love equipment modding allows weapon gear relevant basic weapon movement option vast wide slide glide wall jump bullet jump space ninja meme fun,-1
good,4
playing year end say gotten development community active changing player community good event mission complete squad,26
take bit time understand great btw abit grindy update bought plat grindy,-1
play cost dollers updaed recommend anyone everyone,14
awesome evolving free pay win,14
excillent graphic sound effect im downloading cant wait apoligize spelling wrote,11
okay epic,6
great friend,-1
way much love way much way much fun playing im glad developer put much love recommending everyone know steam want many great thing keep playing entertained much new content time install love,23
,3
cant stop playing amazing mean good fp recommend community great fun friend,-1
logged seems kinda cool,20
addictive free get best thing welcoming helpful community join clan itll help long run dont scared watch guide get stuck best company listen fan update going die thanks reading review ill see fellow tenno,-1
played bit joke great combat movement community lack update shouldent anything worry working new story quest huge ftl expansion,-1
good,4
good b,4
good storyline good graphic good begginers pw,11
opinion best time show space ninja rule fact story straight save solar system evil alien tenno called job fight wave grineer etc rescue tenno save solar system spoiler alert find wounderful content warframestenno weapon sentinals pet dojos remember tenno ninja ship awsome remember ninja free,9
fun friend,-1
played day came think amazing coop get chance download,8
duviri update goat,-1
love router wont let forward port great go enjoy aspect gathering material build weapon researching part aspect different frame different ability modding capability overall great,5
dud dat gud,24
great pretty unique lot fun,-1
actualy good putting hour pretty grindy alittle confusing noob fun design awsome weapon frame enemy look awsome top nice graphic recomend friend im huge fan grinding love,-1
