sentence,topic
welcome mission time peepeepoopoo blueprint,-1
cross save available start playing ill say great time playing console,-1
seeing tennocon happened day gathering lot interest think good idea make review thing mean hour think qualified talk third person pve loot shooter collecting resource item craft new gun armor kill thing way space come set ability make special mobility allows get stage ease become second nature know game traditional progression system weapon warframes reach level get hour total rank known mastery rank rank level new gear item locked mastery rank mean doesnt take new player reach highest level gear encouraging try new thing warframes strongest point much weapon modded way wan make super tanky give ability alot power better damage thats make replayable experiment different build gear change look item new people lucky best come item bought game shop cost compared easy say look get dont wan na work get shotgun gon cost quite bit buy main buying thing weapon slot slot booster accessory there trading system allows trade using game premium currency giving economy tho said replayable loot shooter meaning grinding time bad time go beyone extreme game grinding doesnt suit wan skip hey ive hour im able enjoy time thats short review dont wan go detail feel new player see themself basic overview kind expect like hear give try free excuse need get,7
exitreview time spanned year point cant get sad memory super happy say least making choice try best decision ive made made lifelong friend playing thanks de everything theyve done felt supported player legendary much fun somehow tried please give go cheer,-1
youve played feel character moving broken leg movement glorious mention graphic look gorgeous warframes weapon infinite variety much fun playing friend best grindy grindy lot fun recommended,-1
best hour ive spent reccomend done fantastic job taking mediocre transforming content giant great community satisfying loop farming resource building weapon new frame met many good friend made lot memory free thank de done gushed real everyone grindy game reccomend least try get bored leave id understand think everyone least try amazing experience dedicated development team community manager give near perfect game go say point seminiche looter grindy everything intuitive decent learning curve believe worth,27
noticed id hit hour figured write review love ive playing something year go hiatus month longer come something enjoy loop im invested many character amount customization available fantastic freetoplay put money love,26
started playing cousin told day try activity passing time became fun common occurence cousin girl grew playing doll dressup game perfect middle ground cousin enjoy go egging join sortie boss fight spend way much time customising warframes making possible someone belief showing gratitude spent lot money give developer wonderful work art constant development underwhelming patch note grows follows tune life grow learn mature adapt,-1
week ok second week cool third week great fourth week hour cant right fifth week hour problem,-1
ruin life download learn press button keyboard grind hundred thousand hour thing look cool congratulation life method triedandtrue tested thats sure work edit people adding help wf feel free add wish ill try best accept answer question know time round c sorry,27
playing year leaving hard game time come better used surprising good recommend dont mind grinding everything skin available free dont mind working want currency obtainable player player trading cant praise digital demonstrating good development hope company follow suit hail space mom,26
soooo wan na take time thank last bringing,2
pro free played solo group build anything given time various mission type casual friendly community gorgeous graphic design con slot weapon warframes cost platinum premium currency traded player fair overwhelming amount content added grindy nicest fashion option get overall time want something mindless day work easy pick easier mission time want get serious mission recommend giving hour edit playing month time review,-1
gud gamestill gudye gud gamegud,24
good little bit year,2
want developer listen community want community welcome open arm want storyline kick nut make say felt good guarantee scifi lover mmo rpg absolute best world there reason much respect gaming community give shot,-1
excellent example fp done pro nice graphic dynamic engaging unique visual style story good coop pve experience nonintrusive balanced monetization excellent devs communication feedback developing new feature become available regularly con becomes time pvp nonexistent recommend coop pve thirdperson shooter kind get tired take break return later point see lot new interesting stuff added latest update,8
belive wasted money exsisted recommend everybody amazing community,-1
free time money love grind big boom loud bang super chaos,12
handle freetoplay solid fun lore hard understand interesting microtransactions feel justified know freetoplay doesnt get way spent money microtransactions didnt regret better,-1
,3
best community seen,-1
hour yes recommend,2
read many wiki page life reading good thank xd,-1
short version free cosmetic thing trade player ingame currency item obtain ingameso free devs great interactive fandom buy thing shop yeah im lazy irresponsible money definitely support slowmotion clem,12
fifty hour ive encounter element pay win speeding timer unlocking character cosmetic fashionframe item need pay advance lot mission type based case amount platinum currency buy success solid third person shooter satisfying think stuff community ace vet join help get need youll need lot metric ton blueprint weapon try idea many character thought street fighter large roster blown much content free loop keep playing p developer good pedigree,7
yes playing long time deciding try say combat feel rewarding customization feel rewarding modding feel rewarding compared make feel powerful nothing paid grind everything need best thing free offer ingame market developed community let trade ingame item game premium paid currency terrible sense guidance new player recommended look guide see progress fun,7
fun addicting stay chat feature jobless freak moderate,1
favourite game win pay win system made much better everyone year went less finishing achievement quest grinded frame weapon finished last mr test nothing left keep logging help guide others newer update dreadful eye feel lost touch knew enjoyed thankful friend made time playing fun go give thumb old content trying bit hard beginning figure work,-1
gave shot scifi rushy run gun blade battle way generic enemy generic structure planet surface fun free forgotten tenno came battle realized story fragment enjoyed narrative understood content feature saw need took needed challenge levelling collecting loot earning new equipment progress satisfying saw delevoped became better tenno saw changed became possibility made fear effort need reach star tried reach perfection tenno abandoned urge serve greater good strong tenno came found inner self journey loneliness know challenge come know enemy soul know way perfection obstacle overcome tenno need patience mercy understand see lay obvious universe full diverse content storytelling brought tear eye dear digital extreme please keep following path,7
peak free game tell devs care player creating quick buck prime example make free fun fair devs take note,-1
space ninja meanyeah game addicting possible get everything want spending money think challenge justdont forget homework,-1
best freeplay paid ver game,14
good edit ok,-1
welcome mission time peepeepoopoo blueprint,-1
idea whats happening fun,15
tried seems good,20
wouldve achieved lot life,-1
aight getting good update ton content easy make premium currency spending dime,12
bought space gun using space money used said gun space zombie casted space magic said space zombie space ninjad way space used space parkour space sword space kill returned space ship rubbed space space dog today good day,9
played majority lifetime seen ebb flow leave word try spoil much itll bit long read massive gripping profound way several reason best game made opinion see element greatest pull movement mechanic combat quasigambling lore community notable flaw harsh bug pphosted multiplayer steep obscure learning curve developer propensity creating content island flaw done way feel turnoff movement satisfying much part moving make feel strong limber wellhoned running jumping gliding air flipping nobody business vehicle character get move movement feel wellsuited let say youre controlling something bulky feel heft way youre controlling something bit weaker way behaves make feel frail side etc combat make feel true murder machine marysue cookieclicker kind way engage get feel god movement big part lot enemy type different weapon unit afflict debuffs youre careful etc higher level debuffs spell immediate demise gunplay melee wellcrafted wide array choice go weapon get thing done better others certain case turn created meta thing use anything get result using different combination character ability mod quickest summary mod gearattachable item change output case mechanic piece gear modding gear work combat fundamental lot fun experimenting different mod build gear companion summonables gear item character ability help battle thing think fantastic combat ill cut make centered point speaking mod going think conflictinducing point bring rng random number generation deciding loot get get lot case call quasigambling scratching itch brain arent sacrificing anything time argue time put trying get loot rngbasis equatable realworld money disagree thing get drop completionist way burn candle crematorium thats path try lead intent developer lore pretty isnt splayed quest mission touching serious complexity place wont say truly nice fragment lore collect different way know story story doesnt pose roadblock progression feel case game say cleft lore divide section positive player forced go specific part lore give important exposition gear content follows divider feel lukewarm progressing community lot game exist separate community plenty thing influenced community taken community idea digital listens community value feedback interacts community feel left read taking account gargantuan level feedback community shoot devs way staff taking relaying line seems small group surprise thing take long time process lost wayside community active affected community developer recognizes value letting community part developing mention seems attract wonderful caring people welcoming place comparison many place online con bug break variety way update brings new bug table annoying worst screw one hurt one render client unable update account mission example let return rngaspect youve done endurance mission good youve stayed hour fighting mission get reward get finish mission doesnt update account lose stuff got mission bite hard loot dropping bad getting loot giving tie next point multiplayer session playerhosted worst bug happen poor connectivity client host case bug wont occur connection host solid bug wont happen poor job explaining important thing thing stowed menu people miss briefly mentioned tip corner loading screen thing left want find stuff lot player prof insurmountable task community step help someone asks help chat left community imo isnt downside everyone lot player feel youre thrown deep end pool youre exploring want tell rough ask fellow player get track content island issue raised many time devs occasion tried implement way fix problem remains im neutral different part divided anything give reason new island drop frustration people much valid seems something devs forgotten havent figured there doesnt constitute problem hinders flow feeling kind stranded particular content happens easy hit chat people playerbase active lot time board stimulating colorful timeconsuming emotional experience havent scraped surface many year feel excitement playing got time invest scifi fantasy action recommend,7
number go bigger make brain make happy juice,-1
best free consistent content update try,-1
played beta hour time fun lot played much burned moved game time passed talking friend played wf comment going recognize holy smoke thing changed digital extreme stuck gun put everything wf didnt stop start begin dc universe cringed thought story pulled wow blast core wf world wf changed better much better im happy become wf recommend looking online shooter played coop solo way wf great check,-1
know got ambition there lot love lot stuff super pretty looking feel great experience biggest complaint grind get stuff player v player way people pvp shame favorite thing similar game connection pvp pve bring gear pvp make feel win doesnt finished build liked year casual maxed build happy thought pve mean sure need keep way lot stuff goal get stuff fighting cool enemy boss higher calling think pvp solve thats opinion dont know im missing point thats feel id recommend playing year ill year come casual enjoyer game,7
game quit reason come get immersed recent addition plain eidolon dont know set space eniverse multiple planet explore ninjalike different race player oppose grineer corpus infested different enemy mechanic face pro free amazing visuals great optimisation choose player want solo multiplayer lot different mode player enjoy lot different warframes weapon enjoy fixed archwing dojos variety different mission enjoy freeplay paywin con point get repetitive farming something feel youre mashing button infested update time due launcher least people overall great worth checking high quality free,5
free try great story great amount thing great community nice staff common event nothing cant farmed cosmetic gotten selling item pay currency trading standing various group reason try,12
played hour total know hell doin boomboom pow pow good hardworking devs u wont find free anywhere,-1
wholesome community internet people supportive goal willing help get nothing themselvesbut gifted boost crafting material kind higher level player hanging mission grindy easy chit people zone favorite music impossible rage,-1
product received free ninja check check melee combat check pretty graphic potato pc check ask free give everything want enjoy ninjaisk,0
free pay win,14
,3
player starting open eye lot nothing filling void returning player plain eidolon love welcoming community happy help need catch sitting today writing review mate sat discord call hour playing catch quest grinding junction opening received many welcome gift welcome surprise much getting people slot weapon slot companion slot etc took flag ran dont write review chronic lover player best community refreshing rivaling final fantasy community wait jump starting get itch see friend come talk super,-1
person reading youre nice day,18
played hour good p,2
played take note second dream release given lot love care mere game content new wanted free thats pay win warframes looking pay win glance warframes weapon built blueprint instore blueprint earn bos fight material find playing ingame prime warframes weapon earned void relic traded platinum game premium currency economy make possible freetoplay player enjoy game cosmetic gather resource need little effort everything take short amount time farm long time cook pace accomplish lot week playing youre early hour doesnt hold hand expect get confused modding forma system satisfying learning experience reminiscent gaming put bloody effort game combat fluid freeform parkour system fun use fit fastpaced combat digital extreme history aaagaming darkness great short providing love support informing community future plan hand recommend mean friend got k hour find reason keep playing launch,7
product received free look hour thats highest hour count ive played library farm,0
,3
game good fun friend oh r artist good,-1
great issue surrounding pro opinion feel pressured buy platinum trading easy getting credit frame character ive owned felt unique pleasurable look gorgeous hand use lighting make look fantastic mission repetitive time enjoyable friend great variety frame weapon mod challenge learn coop easy lagfree ive experienced con bug time mission repetitive said player stand nothing bad summary pick friend become ninja today,-1
played small penis girlfriend live none thing changed good,2
good life life new life,18
excellent story innovative eyecatching graphic thick as ask,11
best fp game,13
product received free better,0
ok told reach hour ill write review im tell review better tell customization mp third community isnt thaaaaat bad fourth devs kind listen fifth grind exhausting get stuff yea good thumb,21
looter shooter ive tried year fallen short anything longlasting see meh ill keep playing countless individual delved aaa looter shooter true giving solid amount playtime week feel statement warranted impression zoomed map went there content free polished mean see reflection polished fortuna nd favorite town videogame tristramfor unique creative content im hooked doubt ill buying looter shooter quit week im glad didnt bother buy anthem complete deserving money support thank digital guy gal cut rest,-1
slow burn take time effort build get heart said doubt best game amount thing endless game amazing hidden gem love devs community outstanding new player welcomed open arm yes pay system place everything pay farm dont need spend penny give good soild try amazing,-1
framed war real good,11
best free model encountered content locked paywalls decorative stuff impact ingame currency buy real money platinum locked account tradeable amongst player lootbox gambling decide buy stuff get pay wish travel started playing tell day excited major content update fp next fallout see reaction,12
good hour,2
,3
im okay,20
edit lol new expansion take place day born ayyyyyyyyyyy original review applies btw original review there,21
product received free liked fishing,0
product received free pretty fun hour played neat,0
day hr mastery conclusion nice,2
welcome rice field,19
better free version anthem,10
solid fair fp ponderous amount content community super chill helpful handful people fuming nerf obnoxious weapon moment,-1
much content free,10
better,17
ive played ridiculous number hour try objective amount information new player overwhelming understand series small bitesized dopamine reward fun story amazing complicated maze political intrigue alternate reality know people heard hour theory get better x hour came enjoy power fantasy space ninja stick reveal mastery system,-1
ive started playing year free looked nice surprise free there spend real money want progress best thing amazing addictive lot grinding many thing beginning overwhelming recomemded,-1
product received free okay,0
ah spent hour lady wonderful grind isnt insane balancing decent pay win yes pay win single prime besides excal havent paid dime got ta know buy cheap sell expensive trading great graphic great optimization guess free,-1
love fact everything want able earned work exception cosmetic available earn one said easy given time graphic fantastic control dynamic multitude character use based style wan run hardline tank problem wan blitz spreading misery possible got covered dp status effect many option available devolve bit farmathon time find people help crack love put little pick problem free offer great deal fun,7
perfect made people enjoy making show full heart bold idea afraid get weird hard follow point timer relic past refuse let go complaint find something good music world story dare try something different tired world live service game mix cool thing devs wanted see make worth playing,-1
,3
best fp ive played runescape year,13
product received free time log black coming ive clicked shutdown button recollection playing thousand hour something space ninja men wall wouldnt know wasnt conscious anyways good recommend,0
best fp time there thing paywall stuff currency grindable cosmetic free event paid cosmetic combat fun like space parkour pewpew,-1
updated shown alot different style give huge recommendation new player,-1
amazing fp impressive development team evolving new thing added,-1
wanted ninja wanted space explorer wanted ninja farmer wanted space farmer wanted ninja space farmer travel space ninja farming credit mod good thing blast great community moment updated day fix big thing tried alpha lost interest found love try free applies year btw,-1
live city developer know amazing people true gamers thier host regular stream dev chat update new feature,-1
clem clem beloved,18
little seems okay,2
amazingrevolutionary brought concept industry,-1
think best free game,14
come long way started playing say majority great let start describing shoulder thirdperson shooter role ninja warrior space solar system chaos maintain balance many weapon type choose different frame use suit playstyle possibility endless certain strategy higher level mission veteran player tell work much mmo point certain class warframes work farming resource certain mission developer release new content operation introduce new feature example newest addition corpus dropships drop squad enemy battle introduced operation reborn featured reworked bos dropped ship squad regular enemy bug awesome support team quick respond report get hour become best free game played graphic excellent job immersing living breathing world changing say certain aspect require pay feature certain weapon cosmetic pack work spend decent amount time everything important attainable paying money encourage support developer buying thing like discretion speaking thriving market ingame currency platinum spend platinum buy part mod hard obtain aspect player selling part mod player obtain price vary rarity trying get site wiki question said thing great experience reading longwinded review try free feel free add ingame best helpful possible name mixmasterson see battlefield fun,7
playing yesyesyesyes yesyesyesyesyes yesyesyeyesyes yesyesyesyes,2
played little nice,2
prety everything obtained trade patience reached point left collect weapon cosmetic made money platinum time high ranking player seen many type player many change trading merciless start provides interesting learning experience read mind person side screen took couple hour figure parkour mechanic many able hold ground enemy think stupid realize stupid hit legendary grind striked player remain playing seeing new content put fails impress looking casually spend time friend astounded copypasta map hold great beauty laugh funny bug found rare occassions fight honor merciless tenno find challenge mastering game distinct mechanic unmatched thirdperson combat welcome join,7
better anthem,10
amazing great mid end amazing customisation thing need worked little new player experience get people little tutorial explanation start wait time mr weapon bit silly wish made obtainable warframes weapon make itll keep new player wanting ive invited friend passed hour mark early pretty boring bad anything need get updated fixed,-1
product received free try kind thats fun u get bored u forget like month remember reinstall week u forget,0
played couple hour seems good,2
great free way pay win developer great play self aaa quality,-1
great community amazing helpful matter platform,-1
good free doesnt push microtransactions face min decent there much polish refinement youd think aaa major publisher developer option menu great run decent frame rate system toaster run high setting get offer rebindable key offer rebindable controller input rarity day developer need take note free,12
best fp game constant update amazing dev team get repetitive end,-1
beware new player lot learn doesnt teach holding hand completing early tutorial mission youll find world vast complex tactic character nuance trick youll pick fun grinding mission time launch learn something new im enjoying time immersed cant believe fp much offer side free mechanic done doesnt block turn snoozefest dont want pony dough,5
grindy loop incredible fun make ive put hour thing new thing want earn tend month stop year come finding new content pretty great,-1
time played skyrocketed crossplatform progression dropped love grind pick enjoy great feeling surprising amount story protip dont spend plat speeding foundry item wait lil spend slot rest,-1
course everyone there lot grinding need bunch patience get point able build prime frame thats real feeling accomplishment,-1
pretty good,20
didnt think id wrong one favourite game look complicated get easier look go hardest content turn brain function muscle memory community great hardcore content full tryhards people take game culture shock hardest content chill helpful people ive met mmo ive spent entire steelpath run random people chatting trying help someone build discussing various build recommend trying struggle duviri colour shifting give headache fun regular update there flavor text hilarious there hotfix there plenty twitch drop cosmetic etc event give good reward,-1
isnt anything special revolutionary exceptional timeless time returned kept playing least hour regret digital extreme made enjoyable engrossing spectacular find team better invite friend need new opportunity slaughter alien try,-1
free game go best market,14
favorite farming simulator,19
