sentence,topic
ive played year recommendation freetoplay offer staggering amount content doesnt force egregious microtransactions step way good portion pay anything weapon warframes like take considerable time build sped platinum ingame currency dont wait feel money need spent slot weapon warframes type collect vast armoury pay trade platinum stage youll likely decided want continue playing trust decide stay bundle platinum buy slot gear fair content offer wait sale platinum youll good go way looter shooter good perfect gunning fool couple mission chunk hour good time round fun best way sell say space ninja run bunch suit called warframes collection sword gun knife lot kill thing style frame set power complement weaponry run variety different mission type main faction grineer corpus infested space nazi corporate jackass space zombie there story sprinkled come experience second dream onwards interesting universe explore sound kind deal go get tiger freetoplay overwhelming time gotten new player recent year advice dont bother everything focus little thing find weapon favourite frame suit playstyle work way friend join clan help whole played solo lone wolf impressive thing there like different game focus leveling gear building new frame running mission fund there clan side drop tonne resource credit building dojo mamma proud getting blueprint stuff throw lot certain faction run special mission curry favour opening relic running void rift mission get special prime geartheres lot want go particular rabbit hole thats scratching surface downside note ive new player experience confusing start whats point running mission supposed open work time repetitive run similar mission gunning slicing way horde fodder objective worst offender lack documentation lot certain part drop whats best damage type faction find new warframes wiki friend lot shooter lot content bunch weapon different class wont go wrong flaw free doesnt hurt try one favourite mine fixture library time,7
fun free fantastic,10
,3
high quality fp coop size people actual start shoot enemy crowd robot mutant great variety mission pumping system experience get character weapon fight interesting system improvement visual part full color effect lot explosion lot glowing stuff nice say pvp future battle horde mutant p forgot understand want mission go shoot everything fall place sorry english fp,-1
great lore huge variety customizable weapon pet warframes endless timesink good long session quick void relic run work say get monotonous break help lot friendly community cease amaze generosity helpfulness devstreams watch inside joke childish humor mixed cool content coming,-1
grindy fun,1
hell fp sum amazing,13
hour summary awesome wide range mechanic indepth lore creative storyline satisfying combat amazing art character customization indepth rewarding content including story free certain rare cosmetic access bundle farmable purchased support developer community super friendly helpful reach player forum ingame question certain thing work beginner tutorial get going suggest favouriting want get good endgame content creatorbase youtube large plethora tutorial video conclusion parkour spaceninjas utilises magic sword lazerguns mechs jetpacks rocketlaunchers destroy horde ancient alien clone robot looking super cool remember pet cat,5
top scifi universe happy discover quality story mission cutscenes rising year great community developer great skill mixing solo story campaign coop mission free monetization aggressive broke atmosphere,-1
legendary run slower pc,29
best played havent tried worth time,22
fun friend,15
grind fun,1
product received free need long wordy review humble opinion unequivocally greatest video game time best freetoplay played ive played lot level quality support devs given continue give unmatched dont believe ive seen dev team touch playerbase download stop playing complete quest called second dream arent hooked point aint idea hypothetical person shudder thought please show digital extreme support deserve,0
good,4
good enjoy good third person shooter,16
pog,24
game story movie absorbs many purpose many mission type lot character weapon nice modding system change weapon wish try different build focused farm grind type game suitable excellent image quality feel planetary atmosphere space necessary friend enter clan comment party masterpiece tried recommended,5
good,4
overall opinion fluctuates im editing review enjoy im able get began playing year new player experience saddled larger larger backlog time helping friend get see kind monotonous grind expected daunting patience progress seek external advice fan wikis offer satisfying experience many goal grind need lot time get offering premium purchase time previous version review talked gripe surrounding story found older content cohesive part game newer content grating many element feel iou writing introducing new term invention told origin confusion intended order add mystery point feel introduction skipped shallow attempt force unfamiliarity said part story offender enjoyed new content deal abstract concept grounded appealing cast character,21
pro old keep getting new update improve graphic mechanic character customizable rpg element make interesting coop mode fun friend playing optimised graphic good surround sound free con deleted following reason pc used run problem time update process pay win kind keep spending wan na survive new map match making take long time inspite end playing bot recommend much better aaa title free,-1
man rock ive mmo rd person gear war sword coop fun,8
awesome fp developer making better week new weapon level enemy ton bug fix unique original addictive,-1
love grind,1
made best free ive played fun free yay love way dont need pay real money get epic gear want good work,-1
love grind grind love progression progression love shiny toy ton shiny toy love endgame challenge pvp go,1
something good free,10
blew tried november expected free experience rewarding fair dont spend anything progress everything unlockable tradeable obtaining premium platinum currency trading isnt hassle story pick hard midgame thats started getting attached amazing experience im upset havent tried ive heard word mouth gave shot looked think everyone atleast give try free,12
product received free main account playstation started pc account go new war expansion storyline challenge using excalibur favorite solid interesting confusing story hiccup progression mastery rank requirement star chart obtaining necramech paying real money frustrating took number day complete good arent game service advice new player find enjoy everything get story element unlocks get incredible story reward use part make thing easier decide become collector completionist youre weird nerd want try warframes start save starter platinum currency weapon slot yeah thats thing wan na run starter possible dont worry much cmon who gon freetoplay nature excellent imo various method monetization thing cant get paying cosmetic everything get free youre patient dont mind grinding there stuff get playing obtain premium currency trading player admit pretty time consuming know lot get lot mod prime part sell course running mission,12
luv space mommie space mommie,9
keep going year,-1
got ta agree potatogamers review helpful got played archwing update admit busy seems theyve listening fan player implementing solution problem creative nondestructive way biggest criticism used see grindy mmos old void reward table system new relic see massive improvement reward less reliability offsite resource able get youre looking mention improvement trading communication tackled many issue developer dont seem afraid rethink thing go box granted ive gotten im impressed come much added felt new player return thats much changed new addition intuitive end felt compared stopped playing thats free paytowin go wrong refer potatogamers review indepth coverage mentality player lack creative opposed materialistic,21
ninja space open world parkour grind lot grind best fp game market,-1
best game story space thirdperson mode challenging stage recommend everyone opinion,16
product received free raid fun managable spend time grind real real fp need spend get everything playing spending lot time good luck tenno,-1
free lot fun playing better thought great play steam controller parkour feeling kind limited make feel badass mixing parkour thirdperson perspective something epic gory fun free though black ops iii parkour fun imo think thing called mod let customize strength weapon make combat higher rank enemy lot level world check name flaw using steam controller menu unpolished couldnt get success screen pressing b selecting level want member right show pressing x make wait people turn press twice level want order wait yah cant recommend enough come free,5
leave review point feel ive poured soul fantastic run outstanding graphic optimization solid ingame movement parkour fun addition make paced time dull moment free youre getting much pour serious time hour atm isnt flaw bug irritate heck mission waypoints bugging displaying rare moment falling map deploying kdrive bug find coming customization something many different option skin armor piece color make warframes stand amongst frame modding system upgrade system extensive frame mod way want excel pretty much frame way want there much freedom making build there say going say definitely time money ive put youre fence get give chance there little tutorial find helpful higher mr player thats willing show rope give time get want join clan extra tech get well say good luck tenno,-1
,3
let endless grind begin,1
great free addictive,30
brings many new idea exciting coop interesting grinding time,1
gorgeous graphic run smooth pc enjoyable right amount challenge mission get intense bail level handle character weapon upgrade option customizable style,5
awesome coop friend cool grafics,8
best,17
best fp game steam fast exciting lot stuff improve customize equipment unique amazing graphic tricky challenge complete universe bug devs real good job imo care community take feedback release new content improve extend gaming experience beware u spend hundred thousand hour,29
love,18
upmost honest opinion best free youre looking high quality great graphic regular update new content nice community need pay win everything pure skill gained experience layout simple understand map huge open world explore include way create name weapon modify gun melee ideal say bad thing played p early fell love straight ranking system easy understand irrelevant allows opportunity mod weapon higher level longer mention recruit channel allow squad range player different ability weapon mod skill set help aid mission people mention farming issue alternative paying something real money youve read download ninja free,-1
great love way set recommend,-1
bit grindy insanely fun start getting new equipment played bit steam changed lot better update kick as,-1
started nice beautiful nice interesting many thing free go try see,11
product received free fun space ninja,0
havent played much got ta say good free space ninja couple differenet character called person shooter combined hackn slash different mission different enemy example grienear think butcherd free nice graphic course come market stuff buying money starter pack kinda stuff saying take long level get money able buy anything customasation change color weapon seem able craft different item getting kind drone follow im experience settle real fun friend got patience real get need free play,-1
decent cross save,-1
best free,10
mediocre singleplayer experience great multiplayer experience youve got consistent cast friend freetoplay mmo grind manageable stuff buy stuff grind actual advantage gained paying money saving bit time grind believe thing real money buy cosmetic storage space youre sort pack wont throw bad mediocre piece equipment leave unsatisfactory hole collection gameplaywise come long way humble beginning feel badass space ninja simplest movement combo combat action soundtrack excellent visuals stunning see constant update buff reworks stuff doesnt work ended underpowered constant introduction new frame new gear new quest new area etc havent played year return learn upgrading innovating dedicated crew storytelling love hate people know included fall camp roll eye make wanking gesture suffering story part people excited story part im latter camp think execute story complaint make part require bit much grinding levelling quill vox solaris thats dealt subsequent update dont mind bit research see effective approach,-1
wowwee,6
immerse future strenght make rule power imagination acquired weaponsskillsninjasrobots combination masterpiece called good storynice increadible feature grow time pas,5
cool,6
fantastic ftp time anyone calling pw doesnt know mean succeeds flying colour monetized ftp constant new meaty worthwhile content storefront doesnt rotate hour put shop exception give try wild fun ride,13
hour going lot potential future developer continuous support good community diversity designed want invest lot hour single take time learn everything choice gear knowing enemy personal week experience full learning thinking amazing new upcoming content sound sweet experience new content month keep fresh time player log,-1
good,4
amazing free ive seen mind ive year started playing community friendly join clan there high chance theyll donate give boost character frame unique design there tone gameplays stealth dp support tank speedrun dont stick something called modding add mod make said go fishing mining exploring open world story mode dramatic capture thought ride hover board fly jetpack wing archwings drive space ship get itll time bit slow start,12
good,4
played friend today agreed great free containing beautiful graphical work interesting mechanic good controller support get tedious nothing make stand failed thirdperson action human tough get grip contains lack explaination certain aspect upgrading customising character work id recommend giving bash good bit fun nothing see playing long term spending money,8
nice,28
grind praise grind become grind grinding done sacrifice life greater good,1
fabulous casual load stuff keep occupied currency system top notch doesnt gate form,12
playerd p course built pc knew seems mod drop different pc version lot fun people know better fun friend bit learning curve learn basic youll way,29
developer keep fresh genre easy burn great listening constructive feedback make change improve loot grinder fun update fashion frame op,-1
freetoplay paytowin perfect combination addicting understand endless thing farming mission againiimgurcom yes thats something common good thing level layout change time mission,-1
awesome gameawesome graphicsyou spend hour guarantee,11
many year release best free shooter pvp part worth mentioning beautiful graphic shinny lightning effect massive multiplayer coop open world mission instanced strong player base dont friend online fun sure get stranger available matchmaking system offer hundred hour intensive adrenaline rush fun solo coop interesting short personal story follow finish challenge quest develop character access certain function ability playing character spaceship spending dime want best gear weapon invest funny player spent thousand hour criticize offered thousand hour fun free personal opinion please dont count valid,8
best online action,-1
little complicated nice,2
grinding enjoy grinding wake screaming night nightmare thing dropping map little piece gear drop shiny ass men,1
better doesnt cut content expands much unlock work towards feel powerful reward time put ive playing much inception fp title steam come,29
mate want fast paced coop action ton loadout option lot character option smooth great visuals customizations wazoo ticket entertainment everexpanding rd person shooter provide countless hour carnage sick collection character weapon upgraded modified suit style solo good coop fantastic id see developer take page book regard making coop exciting pvp use little work expansion fort capture capture flag biggest critisisms offer use bigger bos battle little bit ai improvement various enemy throw type battle format arena fight instance little vehicle warfare space ninja hoverbikes bee knee current map playable make good instance open world approach help bring gamers scene question,8
holy moly let try describe line free indescribable beautiful graphic singleplayer coop multiplayer great mechanic downside expencive dlcs feel thing mission recommend hour get feel going thing,-1
relaxing ive played yeah there thousand micro transaction everything buy farmed earned daily reward weapon bought cant used pvp terrific modal combat system exciting make feel ninja sense youre bad as pro con finding best suite style make fun stick us different situation mod system bit tricky overwhelming hour researching consulting chat clear p likely google tab open month playing year playing google build find best farm location much anything note best friend get get boring lonely try forming dedicated group pug possible keep social youll amazing time joining clan wont hurt,-1
true definition masterpiece,-1
warfame fun friend glad free wasnt buy,0
best best gaim evur,24
fun friend grind,1
go fsssssht blaaaaaam gagagagaga pretty great,11
great tutorial make microtransactions fair,-1
great say,6
awesome everyone try,6
great release recommended like grinding loot lot system interact long ready search wiki page explanation system work,-1
playing hour say way year im glad devs working enjoying new warframes weapon added open world rework review need think making steam norinate award task finish fact mamke review good,-1
free coop player solo wish great game lot customization different style get updated good thing space gun exploring different planet solar system obtaining mineral blue print mod create character build craft new weapon make new warframes playing hour im fun thats saying something explored planet overall enjoy love get updated new content,8
im surprised come graphic gotten repetative gotten beta gone enjoyed game mass effect multiplayer gear war horde mode type crew take endless wave baddie pure coop awesomeness sprinkled loot grind dungeon crawler diablo torchlight blast say thing negative real world dollar cost item everything gained rng luck time mission currency great worth checking free got lose,-1
community nicce helpful approve,-1
pure awesomeness sure get grindy everything non aesthetic achieved playing longest farming run ive day truly fun casual clan much paywalls entire frame weapon slot cheap free make money somehow weekly update show dev team determination keep fresh dedication community,-1
wanted add year find putting time towards great job digital extreme refreshing take squad based rd person shooter art design gamers taste find refreshing take design character alien unique inspired striking compliment art direction whole team tight responsive franciticly exciting giving player experience feeling theyre true space ninja youll parkouring obstacle climbing wall hacking apart enemy sliding floor going john woo anyone stand team objective ninja ive found coming friend got way june today ive spend hundred hour warframes session pick half hour turn longer survival raid open ftp paying player dont fp player department dont spend time gathering crafting item found created miniumal grind time compared many fps work digital extreme give try wont disappointed,26
boy start gem average rd person action freetoplay growing playable universe easy fascinated year team digital extreme introduces new gamechanger equivalent sequel integrates core current result year nonstop hard work dedicated fanbase premiered simple action shooter based quick match defeating horde enemy completing different objective compelling cinematic experience got open world third work craftable character daily weekly challenge endless reward huge variety enemy dispose upcoming space battle mode increase scale seen level graphic keep getting improved time think look old today standard wrong coop element crucial nothing beat experience full team space unique power weapon wreaking havoc horde unlucky enemy squad able connect real time complete big scale objetives taking orbital enemy base easy get started take lot time dedication master dedication translates farming farming xp point resource credit mod blueprint etc playable content become huge youll feel farming tedious everytime succeed crafting new weapon bloody satisfying game major downside chance youll feel overwhelmed everything offer hour answer community ask player there chat make friend learn make easy communicate people find next step communication organic get way playing game story becoming elaborate epic time go many surprise way whats store future look promising there particular revelation many hour gamer experience incredible term worldbuilding affect perception whole story short got time hand youre looking ultimate coop action experience think try thank review updated july,7
fun like go,15
buy much fun gud,24
best fp,13
like paced crazy wall running shooting slide wonderful world join community gamers helped build come space tenno awesome,-1
amazing fun friend,-1
awesome made fp captivated minute different combination weapon warframes companion enemy mod combination mission content make exciting challenging find way continue farming fun friend ingame purchase gain advantage necessary fp need pay cosmetic item want thing possession community super nice clear recommendation enjoy,-1
feel state enjoy played look delivering narrative big fan grind open world stuff rest good give good recommend,-1
free finest,10
fun countless hour content devs good listen community time lot variety available content go space ninja zooming map humble fisherman free new content added old stuff sits gathering dust experienced player new player worth going get reward,-1
fp proud say part community year digital put ton effort hour make enjoyable playable minor bug pop solid story want space ninja gun slice murder everything look enjoy solo team fit need optional payment pay win item weapon companion farmable use actual money isnt make overpowerd way get want farming forget mention lot grinding stuff huh,-1
great boring lower level get mean addictive progress level paced immersive environment good pick shooting lover,-1
opinion best free game,14
great grinding great graphic great development team new thing explore time constant update,-1
pro easy jump deep good progression system doesnt force spend ton money enjoy con challenge terrible confusing new player experience,-1
love feel bad as version mass effect exploration story best co op xd big variety mentioned story free,11
year ups down running rainbow colored excalibur maxing true endgame fashionframe watching single devstream jumping hype train time departed good time grew grew conclusion past year new war time move steve geoff scott countless hour fun uncalled deserved buff amazing story loop farewell hello soulframe p totalbiscuit seen preorder lad preorder,26
good,4
best free world keep gettin better edit edit edit edit fomo edit regarding edit new content isnt tedious get edit leticia lettie garcia,2
nice,28
,3
amazing free gorgeous fun,10
beta set interesting styalised universe compelling rdperson shooter mixing gunplay melee unique ability overall enjoyable actionpacked lorelacking moment experience yes lack depth story doesnt much game great visuals individual artstyle design free worth trying give go,5
least better,17
best mmo nuff said,-1
recommend course damn good fast action team work miss game pay win everything depends skill reaction accuracy moving style go download wont disapointed,-1
ive much fun amazing impressive interesting concept nice asthetics board boot fun main drawback endgame massive grindfest depending want go fun fun experience part today,-1
love life,18
k hour shame great great community great development team havent played hell waiting go,-1
year constant updating make exciting great plot land combined bright graphic rich contrast universe distant future open eye player world constant fierce struggle possession resource ownership creation disintegration alliance union fight others one stay bloody battle world full extraordinary character thrown space part galaxy player choose ancient powerful contestant role tenno called warrior spent century temporary state suspended animation completion old civil war central character warbased faction faction clone soaked durable hardtopass armor use type weapon entrepreneur hire huge number robot installed stateoftheart technology protect infected group includes robot human affected certain technocytic plague dynamic character fight enemy handtohand combat longrange combat use parkour complex element allow player overcome obstacle countless trap player prevent attacked managing character convenient physical component struggle brings joy number character showing great deal variety none turning role player find look performance feel confident impressive selection weapon accessory supply help player achieve goal unquestioned advantage game multiplayer project stage pve multiteam team player find lot interesting thing key success high level performance graphic great love community make feel valued player playing getting rare new era gaming thank developer welcoming player base,7
playing early beta say year evolved legendary title say doesnt flaw anything doubt great grinding lover list con improved post review list pro early struggle going beginning creating seperate account direction people dont know look someone doesnt know look info dislike misunderstanding overall isnt everyone opinion fantastic p,21
great pretty grindy time consuming cant recommend everyone good mechanic neat graphic great community get update overall good free,-1
