sentence,topic
good veteran who explaining guiding impossible come year dont enough time atm get master degree love enjoy movement great unique artstyle day like edit btw feeling edit veteran friend enjoy critique stand tho way complicated much everything best looking feeling game time art design godlike belongs museum skin artistical quality insane course movement great feel great yeah love time ill enjoy future,-1
best freeplay paywin mechanic dedicated beloved development team surprise spoil player expect proud founder roam towards sixth year playing,-1
amazing addictive plenty stuff grind quality game require money pro fun lot update pumped month great community massive arsenal pick choose everything obtained free trading system con grinding boring time cause burnout power creep want proof addicting look hour played stand point grown additional k hr adding pro great visuals cool design paced smooth ton weapon frame unlock hundred mod collect frequent update special event new content look paytowin con cooperative online doesnt encourages player team lackluster mission objective lot bug slow start insufficient tutorial much left unexplained grindy repetitive weapon suck made obsolete superior option peertopeer system make game laggy connecting others different country dont mind grind lot fun find group people run weak tutorial supplemented trip wiki enjoy fast combat collecting ton stuff there plenty think,7
interesting ninja aspect try show player graphic amazing,9
beautiful graphic great variety mission complete many scenario many boss strong rpg element good reason fight boss great coop earns huge thumb considering fact free event frequent update stuff promised great recommend downside think need platinum money youll purchase actual money resolved rare chance gain platinum magnificent metagame score deserves update review warframes gift keep giving faction varying size codex system revamped damage system ton weapon warframes choose variety mission whole starmap fill ton leveling frequent update frequent event hidden area least variation assembled tile set amazing bright future,5
waiting cross save edit wait cross save played bit pc love much hour console clocking hr pc amazing expirience pc optimized aswell take break time time leave thats sure gem premium currency litterly earn trading player best spending single penny,-1
best video game played fan mass effect great time everything graphic market battle mechanic developed glance saw provided tutorial blew mind figure control game ensured everyone know basic mechanic keep player online,5
time feel worth playing happy progress leave eatrh fun,-1
fun community nice many troll endless grind different mode,1
wow,6
best fp made,13
awesome year playing say wish free time comment needed update year agree xd,-1
great main story mission bit buggy time great try great loop lot fun,-1
good,4
favorite game nothing,14
great looking gota give prop fp kinda graphic hour played great time hope many hour come rest player,2
product received free ive played little fine,0
love uniqueness adaptability way implementing different gaming characteristic stylized atmosphere puzzle shooting stealth alert parkour overall beautiful lighting setting character custimization lot grinding farming item dont want pay real money get thing least feel badass occassional bug getting stuck pillar bos taking damage mission overlook enjoy aspect playing space ninja liberating cosmos style,5
ive playing year yes grindy yes require lot time developer pushing new update put previous update shame launch fortuna added new open world map look amazing see effort put detail new map cant wait release railjack update november th railjacks implemented excited finalize implementing railjacks cant wait empyrean update march th railjacks implemented get second wave major railjack content corpus mission node railjack,-1
playing year time post something free alot fun singel public mode got huge update test,-1
nice farm everything need upgrade thing want upgrade,19
steam closed beta tps realy paced truly original nice concept waframes armor gun melee weapon player made player idea thats awesome mean creator willing make want progride comunity say best tps much replay possibility much fun free item visual functional free get need friend time get,-1
designed fair freetoplay best getting updated amazing devs listen community,23
reason amazing graphic free pw ton content enjoy grinding farming system mechanic fair balanced reaplayability value fun friend extraordinary community helpful friendly make many friend many,-1
great,6
great combat excellent art style power grind bit slow inexperienced plenty video online help yes free want advice wait platinum sale get plat help make grind fun skip part dont interest people worked hard achieve think deserve money winwin situation keep making content keep enjoying,-1
hand free experience available ton fun content slew warframes weapon collect build cosmetic content isnt locked paywall anyone get premium currency trading ingame economy rising falling price great love,12
product received free year reached mastery rank playing review left several time find playing comfort zone best there something make go there much goingon thats reason left due burn keep coming seeing new stuff added experience much fun thinking experiencing everything offer conclave lunaro xd proud tenno btw planning start playing aware lot mean lot offer buckle enjoy bumpy memorable ride,-1
youer grinding partner start relationship love hang find make free time spend novelty start dying dont get wrong love sex getting repetitive start looking thing make interesting luck something new spice sex amazing followed grinding death novelty cycle keep going stay loving relation partner mean,-1
free third person shooter combined melee combat parkour system great mechanicswarframe best fp game therethis isnt pw gameyou get anything spending real money lot weaponswarframesand mod modify warframes weapon stats get lot customization warframes egcolorssyandanaweapons colorshelmetand cost plat platinum buy color got lot color free event halloweenchristmastor celebration lot relay trading place trading peopleand clan system gamethe quest awesome cinematics wont forgot second dream war withinbut dont want spoiler inside questso warframes try,-1
game thats diamond rough great youre willing invest serious time easy minute hour say dont know im generic sit give time find unique niche fighting style realize adjust adapt tactic strategic situation frame unique power good know utilize right situation right time difficult battle calculated attributing factor fight broken speed v power power v technique technique speed power v crowd control crowd control v stealth example factor take consideration finding fighting style many right modification weapon warframes begin merge ability super effective fighting style take time fact multiplayer coop help later level trying go work long youre going need reinforcement right team proper weapon seem unstoppable time thats beauty design make feel get stronger making feel youre invincible stop trying there something someone thats little stronger thats keep going pursuit improve said diamond rough obnoxious section situation put example drop rate certain rare material ultra low meaning youll grinding level get material need making stage redundant youll find need clear specific level squad nobody breathes particular level youre trying get make waiting painful time dont feel waiting squad show give option start mission forewarned better super prepared youre going solo minor flaw nuisance great good time thats try bring friend journey review give try least take someone elses review gospel fact decide reviewer made fair point,7
remember played day school dying pc thanks good old day,-1
nice yes shotted aliaens,28
good free,10
amazing want sit good time slaughtering everything path beginer player trouble figuring market modding system tutorial internet tutorial help puting new content week wednesday veteran player keep getting new content keep working hour logged im much enjoying overall figure beginer stuff relaxing want sit easy mission mood challenge face player skill level say free game pay win havnt spent dime get item people pay see big trading system player trade item currency cost real money work read whole thing sugest start downloading day day fun,7
product received free wrote total b review month april wanted set record straight high learning curve best free best aaaquality game steam,0
good,4
guess best coop game,8
pretty nice grinding lot,1
goodgame lot fun,22
best fp game,13
called farming simulator due farming great overall dont get wrong alot farming,19
great got hooked day k hour im bored mention free ingame purchase required anything available farmed skin affect exist support developer tennogen skin designed creator community community great helpful seen community willing ready help,-1
best game played graphic amazing sound awesome there alot stuff addictive fun,22
awesome,6
free lot offer decent ton weapon ability interesting universe interesting plot microtransactions free hour hour problem,-1
amazing love life day,18
short version download happy long version played bros account h account bit h free devs amazing community awesome youll get lot help different player ofc farm material build weapon warframes crap p ingame shop real money buy weapon warframes boostersa lot cosmetic dont need get everything playing normal satisfying need write,-1
best free game amazing continues improve big update youve wanted feel ninja cybernetic exoskeleton suit best time release update includes total revamp melee system get started today disappointed gon continue expand,-1
best free pay win pay advance main thing premium currency used cosmetic slot use currency speed building process item market farming dont need recharge account premium currency trade mod prime part special weapon crafting component currency,12
thanks make free becuase game graphicgameplay download,14
founded love,18
fp game feel done kind lost hour mechanic clicked started progressing im enjoying time lore something wasnt expecting isnt throw face made curious know universe,-1
best game day free said continues outdo competition consistent quality update content release set standard fantastic free ive playing year plan playing least,-1
great start pas learning curve sorted important thing game mod weapon warframes load fun got scammed went negative platinum due stolen platinum received point wont get support pay euro get spent stay locked good year refuse pay scammed find new aware great support help devs see many post regarding customer support careful trade update team got helped melting flair restore balance got account took month several attempt contact least didint left cold many change year getting finding new way enrich environment im happy come bad moved something,-1
top quality game dev team care player community ive playing love much day dont belive myth grindy compared online game grind fun tedious exception ofcourse fair exception pay win fact get anything spending dime want updated amazing content bug fixxed short game style library give chance change mind,-1
word amazing xbox controler comp use work amazing love coop,8
super cool graphicnya keren feel overallnya asik dan action mantap kebetulan lagi nyari online yg vanquish recommended,11
pretty good guess edit aight year passed last edit solid,-1
real free game get everything playing spending money take time amazing remember beta expect bug,-1
warframes grinding grinding get better weapon frame end game beta evolving better adding new mode new frame new weapon new feature sure keep busy good,-1
new enjoying great coop lot fun entertaining one gomes free game enjoy coop shooter game lot recommend give try,8
,3
best free market unique journey everyone give try wake tenno,-1
,3
playing appreciate much free better varities free content update mission varities best free market recommend enough,-1
review tough there lot say ill try brief great life mother gaming grind make hate rng deep burning passion want hordebased shooter get lost couple eternity youve done grind story pretty interesting there much look fantastic best advice free try next advice use warframemarket wiki enjoy basic get better go true joy tinkering deep modification system game come,-1
amazing shooter worth checking,16
something special digital extreme put much blood sweat tear masterpiece constant update kept coming going beginning early dead gone,-1
good looking lot light special effect freegame real money dont change anything make making itens etcgood theory time get boring make nice event friend dont pacience,-1
tldr recommend top alltime favourite list cent pro easy pick difficult master storyline gripping side quest add understanding tenno devs great sense humour redtext update notice loved part try get friend youre early lot fun team learn work day person got mr result learning thing take mission content added environment changing playing hour please dont forget take break many frame choose dont get view stuck frame find suit teach farming farming simulator get plat selling excess prime part wikia site helpful higherlevel player go wiki check drop chance certain part go farm part pro con certain frame decide get playing hour please dont forget take break run anything look good medium youll find absorbed much timebased mission alert hardtoget resource special item invasion allow choose faction give exclusive resource support prime item constant cycle release vault meaning there stuff get playing hour please dont forget take break clem grakata overall great fact fp make top list alltime favourite recommended,7
best played mr spent dollar needing,22
amazing tough get blast,1
yes,25
pretty ok,20
deserve good reputation seen devs involved player love love,23
best,17
darn good free title,10
played little bit good,2
playing many year im excited uptade new addittions story gamplay recomend,-1
product received free greatest year free development stable support life good bad time keep sane trouble great friend spend hour getting bored provides challenging content elite player time waist development focus new player experience make easy help friend start year playing came back earn lost time wasnt disappointing say lest changed lot good bad pro way con old player dev team interactive community regular patch fix content update seasonal keep busy month end new player like try say go got nothing lose semi player driven economy player option spend money real advantage player option work item want farming item goody sort trade player gain platinum currency platinum premium currency get spend money player driven economy drive lot player due experience platinum used cosmetic trading player content lot take new player large amount content wont feel pushed something take time learn many guide internet view plenty video player willing help starting friend level good idea help friend played long time luck experience good thing double edged nikana waiting happen pace enjoy strong player great team mate amazing urge everyone space ninja man army type stuff,7
yesindeed lord farming tire quest eternal farming glorious day thy dreamed item come sky day day come,19
good free expected gripe grindy force upgrade item long period time,0
special update brings way fun loot system exciting hitting steel want bigger bigger number real recent update time writing seen engaging youve fence take shot community lovely helpful,-1
addictive tired playing amazing graphic good ai maintenance impressive fp hope ive convinced least give try nothing miss nov bored,-1
played hour year cant stop playing cant stop thinking im working preparing breakfast past devstream analysis running cellphone use unique there ton weapon havent seen mmos playing friend blast fp grind cash currency platinum spending single penny need youll get discount awesome customization come cash item customization super complete true endgame freedom build character weapon way youll able rearrange change everything want dont character leveled start complete bottom wan something dont quest mission swap continue fighting try problem progressing ask region chat people community happy help update crossed year line played year last time played something much ragnarok online ninja free come join team b,-1
bud love think look cool,18
glorified free id say money want get pro free variety good graphic event include whole community fly rewarding game something beating captain vor time get prize weapon blueprint etc con ton glitch de trying fix grindfest trying get part need pay skip grindfest get give eye hurt longer hour session lot neon color,12
good time start playing,2
better free,10
best fpgames youll see,13
played hour pal end idea happening loved second,2
son started playing time started nagging start playing hour passed realised found enjoyed graphic good varied intresting coop good pvp good keep getting new thing added keep intrest peeked,-1
pick try worth precious time dont much share gaming life know moment entered tutorial liked couple mission done said year grinding hell yeah aint going turn word captivating addictive free played multiplayer graphic stunning mechanic fascinating community people lucky meet making say brilliant friendly supportive love wish people wondered good say become say piece tastiful cake recommending least try hoping meet europe server cheer lover peace,-1
get good hour edit get better hour edit hour mediocre itll get good hour,2
awesome best free evercant stop playing,14
ninja space ultimate free anyone looking great rd person shooter,16
pro frequent content update decent community possible access content fp fun moment con buggy time grindy unfun mode early suck lack balance frustrating moment overall sink lot time forget year repeat proccess dont mind grind worth try,23
graphic amazing adictive community awesome developer bring neat idea improve alot time get overexcited rush issue get fixed come fp game fair business model beat loaded microtransactions weapon warframes companion skin crafting none necessary shove face spending real money waiting join rank tenno,-1
lot element reminded fave game resident evil shinobi tenchu metal gear solid castlevania sotn dead space mass effect omega boost time love fun playing solo friend youve played dark sector youre going immersed lore love playing storm volt true free title steam best community ive seen fp tps game ive tried steam became game recommended friend desktop laptop pc p good way get introduced steam fantastic work keep,-1
fluent movement using weapon feel satisfying clem there much say little time amazing,-1
nice action best free recommended,-1
best shape youre looking live service doesnt try nickle dime corner give expansion free community welcoming helpful player there compare onboarding experience isnt great get pas hump incredible,-1
original review make platinum good luck making platinum way getting decent amount nerfed microtransactons lasted good allbeit fun youre endgame,12
better thought possible free gorgeous k butter optimized mix environment sound design mechanic make classic masterpiece continues get month,-1
solid sound design fantastic grindy hell grinding gear resource make question life choice brain rot real get wisp prime wisp prime as edit yea rpg experience im playing friend fun watch health,-1
pretty cool beta perfect mix coop tps hacknslash get weapon free,8
friend show ask sure say easy learn kind person mind grinding various type mission order find resource create powerful thing level become badass blast low level stuff god various way show powerful u recommend others fun graphic sharp people help alot,-1
became much grind continue playing say best genre ive played pay win feature get everything offer grinding,-1
played went steam pay win percent good combat good graphic story kind lacking best played people friend course,-1
great great devs compare,-1
compelling story awesome cosmetic create pretty fashionframes,11
amazing begginer impressed graphic addicted unlock achievments person kind game recommend hand,30
imursive free pay win sure unlock thing much quicker everything accessible paying skin cool multiple experiance system brings strong dynamic replayablity scaling,-1
fun recommend course appeal everyone cause grindy core enjoyable friend,-1
great favourite steam thing considered enough needed break suggested discovered dismissed free gave second look play great huge variety mission countless weapon frame farm part build use use game currency buy thing blueprint save time nothing reach understand mechanic little better there real need spend money want major purchase hydroid prime pack came platinum thought need today ive got plat left im happy gave option taking grind spent plat booster cosmetic fair real criticism isnt lot ingame direction community great ive question go unanswered sum say similar developer care,-1
time come little better loved look day keith thompson art design show awesome bugridden sluggish come month immersive actionparkour gem packed gorgeous particle effect set interesting universe come month interface cool customizable everythings latest iteration perfect,-1
fp third person action massive amount content activity playable character weapon crafting etc plenty thing extra fun get friend bit overwhelming new player plenty offer whole learning process feel rewarding,5
yeah pretty damn fun imagine movement style wanted,-1
unforgettable enjoyment,-1
grindy great free graphic amazing fun awesome community digital fantastic job update put content listen community developer recommend,-1
youre looking kill time creative kill op weapon say easy thats point feel goal unlock make favourite weapon strongest playerbase using riven system worth getting youre looking competitive nice graphic pve de great developer best world want grab money whole free get expensive cash item trading item premium currency,-1
grindy buggy none new player experience leaf desired many mechanic rusty clunky way breathtaking game played growing evolving best community privilege part development team digital pour heart soul show single new update spent way money paid feel pay win company deserves cent throw hope fantastic keep going long long time keep fight tenno,-1
amazing ton content,13
,3
paced space ninja action love much getting resource feel grind great free good play good reason try ton content added keep getting time,-1
good,4
hour yeah yeah good,2
favourite,17
figured good colour scheme,-1
good friend,-1
great developer listen community afraid give goody fun combat huge variety weapon frame enjoy minute,-1
vent kid rank achievement rare mr lmfao fun,-1
love,18
fun download asap lol great rd person shooter lot lot customization option casual enjoy p,16
massive grind suuuuper fun friend spare time fiddle,1
connect fun love pure nostalgia wish bring group trial til today opinion eidolons replaced,-1
fun thirdperson space parkour shooterlooter action satisfying loop ton content anything sale cosmetic attained grinding bit sure best free game,16
product received free evolving day day good invest time,0
best ive played many hour im fascinated production,2
played dragged gaming world love heart tho thing seems complicated understand time xd different account im playing im happy,-1
ive playing early many year amazing much theyve changed adapted time awesome customization something major grindfest time im sure mmo isnt everyone unique blend passionate developer take pride love trying improve add best thing feature look completely free give try,-1
better,17
uwu,3
best free league,14
hour nice suck soul paywin element completing consturction item ingame currency trading marketplace developer open player listen complaint time looking universal community best im steam missing come join,-1
free meaning lot thing need earned locking thing weapon paywall earn much item cosmetic fun addicting friend devs try come new exciting content listen community stand strong best fp fun made people understand make fun p grind stop,12
fun free grinding nonstop dont fresh,1
nice updated nice,-1
good friendly player community updated new thing hotfixes good control awesome graphic size requeriments best part forced buy cash get cash item farm minimum minute farm depending luck sell ingame cash cosmetic nothing cant get little bit min effort single cent money involved,-1
product received free damn cool update keep best part bad word safe little ear hear background free start build person wrong take time patence come join fun,0
awesome,6
ruuuunnnn good addictive run chance,30
best waifu dare,17
someone like good free coop allows get anything get microtransactions playing like paced battle shooter rpg element lot weapon character customisation grindy endgame excellent consider playing,8
